-- phpMyAdmin SQL Dump
-- version 5.0.4
-- https://www.phpmyadmin.net/
--
-- Host: localhost
-- Generation Time: Jul 30, 2024 at 07:30 AM
-- Server version: 5.7.40-log
-- PHP Version: 7.4.33

SET SQL_MODE = "NO_AUTO_VALUE_ON_ZERO";
START TRANSACTION;
SET time_zone = "+00:00";


/*!40101 SET @OLD_CHARACTER_SET_CLIENT=@@CHARACTER_SET_CLIENT */;
/*!40101 SET @OLD_CHARACTER_SET_RESULTS=@@CHARACTER_SET_RESULTS */;
/*!40101 SET @OLD_COLLATION_CONNECTION=@@COLLATION_CONNECTION */;
/*!40101 SET NAMES utf8mb4 */;

--
-- Database: `submission`
--

-- --------------------------------------------------------

--
-- Table structure for table `transaction_logs`
--

CREATE TABLE `transaction_logs` (
  `id` bigint(20) NOT NULL,
  `credit` double DEFAULT NULL COMMENT '(no. of sms)',
  `old_credit` double DEFAULT NULL,
  `per_sms_price` double DEFAULT NULL COMMENT '(rate in paise)',
  `tax_status` enum('No','Yes') DEFAULT 'No',
  `tax_percentage` bigint(20) DEFAULT NULL,
  `tax_amount` double DEFAULT NULL,
  `total_amount` double DEFAULT NULL,
  `description` varchar(500) DEFAULT NULL,
  `login_user_unique_id` varchar(50) DEFAULT NULL,
  `user_unique_id` varchar(50) DEFAULT NULL,
  `txn_type` enum('credit','debit') DEFAULT NULL,
  `created_at` varchar(30) DEFAULT NULL
) ENGINE=InnoDB DEFAULT CHARSET=latin1;

--
-- Dumping data for table `transaction_logs`
--

INSERT INTO `transaction_logs` (`id`, `credit`, `old_credit`, `per_sms_price`, `tax_status`, `tax_percentage`, `tax_amount`, `total_amount`, `description`, `login_user_unique_id`, `user_unique_id`, `txn_type`, `created_at`) VALUES
(1, 5005, 0, 1256, 'No', 18, 0, 6286280, 'Its reserl pannel', 'adm01', 'WP-49855361', 'credit', '2022-08-25 12:39:47'),
(2, 100000, 0, 1250, 'No', 18, 0, 125000000, 'altol', 'adm01', 'WP-90861426', 'credit', '2022-08-25 12:54:12'),
(3, 1000000, 100000, 0.1, 'No', 18, 0, 100000, 'tax include', 'adm01', 'WP-90861426', 'credit', '2022-08-25 12:55:57'),
(4, 1000, 5005, 1234, 'No', 18, 0, 1234000, 'anyupdateded', 'WP-49855361', 'WP-47960889', 'credit', '2022-08-25 12:58:00'),
(5, 41000, 0, 0.1, 'No', 18, 0, 4100, 'TAX INCLUDED', 'adm01', 'WP-31142588', 'credit', '2022-08-25 02:15:21'),
(6, 100000, NULL, NULL, 'No', NULL, NULL, NULL, NULL, 'adm01', 'WP-90861426', 'debit', '2022-08-25 04:46:18'),
(7, 900000, NULL, NULL, 'No', NULL, NULL, NULL, NULL, 'adm01', 'WP-90861426', 'debit', '2022-08-25 04:46:46'),
(8, 50000, NULL, NULL, 'No', NULL, NULL, NULL, NULL, 'adm01', 'WP-90861426', 'debit', '2022-08-25 04:47:12'),
(9, 135000, 4002, 2345, 'Yes', 18, 56983500, 373558500, 'Note: revrt back amit mr.mohan', 'adm01', 'WP-49855361', 'credit', '2022-08-26 11:47:18'),
(10, 49000, 139002, 10, 'No', 18, 0, 490000, 'hello', 'WP-49855361', 'WP-47960889', 'credit', '2022-08-26 11:54:04'),
(11, 20000, 90002, 1234, 'No', 18, 0, 24680000, 'hello', 'WP-49855361', 'WP-81909867', 'credit', '2022-08-26 01:00:48'),
(12, 2, 69999, 234, 'No', 18, 0, 468, 'refund sucess', 'adm01', 'WP-49855361', 'credit', '2022-08-26 03:16:51'),
(13, 1, 0, 12, 'Yes', 18, 2.16, 14.16, 'refund', 'adm01', 'WP-44511432', 'credit', '2022-08-26 03:55:42'),
(14, 100000, 0, 0.1, 'Yes', 18, 1800, 11800, 'tax included', 'adm01', 'WP-19046161', 'credit', '2022-08-27 09:19:51'),
(15, 11000, 100000, 0.1, 'No', 18, 0, 1100, 'tax included', 'WP-19046161', 'WP-68682966', 'credit', '2022-08-27 10:20:46'),
(16, 7500, 89000, 0.1, 'No', 18, 0, 750, 'tax included', 'WP-19046161', 'WP-26976349', 'credit', '2022-08-27 10:22:16'),
(17, 41000, 81500, 0.1, 'No', 18, 0, 4100, 'tax included', 'WP-19046161', 'WP-77448271', 'credit', '2022-08-27 10:26:52'),
(18, 9, 40991, 0.1, 'No', 18, 0, 0.9, 'refunded', 'adm01', 'WP-77448271', 'credit', '2022-08-27 04:14:56'),
(19, 100, 0, 0.1, 'Yes', 18, 1.8, 11.8, 'FOR DEMO ', 'adm01', 'WP-60309437', 'credit', '2022-08-29 09:46:16'),
(20, 5, 100, 0.12, 'No', 18, 0, 0.6, 'test', 'WP-60309437', 'WP-66302578', 'credit', '2022-08-29 11:37:52'),
(21, 1000, 40486, 0.12, 'No', 18, 0, 120, 'tax included', 'WP-19046161', 'WP-77448271', 'credit', '2022-08-30 10:33:33'),
(22, 2, 69995, 0.1, 'Yes', 18, 0.036000000000000004, 0.23600000000000002, 'tax included', 'adm01', 'WP-49855361', 'credit', '2022-08-30 04:41:29'),
(23, 50, 95, 0.12, 'No', 18, 0, 6, 'test', 'WP-60309437', 'WP-66302578', 'credit', '2022-09-01 11:12:32'),
(24, 10, 0, 0.12, 'No', 18, 0, 1.2, 'demo ', 'adm01', 'WP-24888979', 'credit', '2022-09-02 05:29:06'),
(25, 10, 5, 0.1, 'No', 18, 0, 1, 'demo', 'adm01', 'WP-24888979', 'credit', '2022-09-02 06:08:06'),
(26, 10000, 1, 0.1, 'Yes', 18, 180, 1180, 'tax included', 'adm01', 'WP-44511432', 'credit', '2022-09-07 02:07:11'),
(27, 10000, 38752, 0.1, 'No', 18, 0, 1000, 'TAX INCLUDED', 'WP-19046161', 'WP-11373591', 'credit', '2022-09-14 11:40:22'),
(28, 10000, 28752, 0.1, 'No', 18, 0, 1000, 'TAX INCLUDED', 'WP-19046161', 'WP-82602410', 'credit', '2022-09-16 10:34:36'),
(29, 10000, 18752, 0.1, 'No', 18, 0, 1000, 'TAX INCLIDED', 'WP-19046161', 'WP-23006920', 'credit', '2022-09-17 10:14:54'),
(30, 5000, 9193, 0.1, 'No', 18, 0, 500, 'TAX INCLUDED', 'WP-44511432', 'WP-40710615', 'credit', '2022-09-17 10:32:48'),
(31, 10000, 4193, 0.1, 'Yes', 18, 180, 1180, 'tax incuded', 'adm01', 'WP-44511432', 'credit', '2022-09-17 10:37:24'),
(32, 9400, 14193, 0.1, 'No', 18, 0, 940, 'TAX INCLUDED', 'WP-44511432', 'WP-34610872', 'credit', '2022-09-17 10:42:33'),
(33, 10000, 0, 0.1, 'No', 18, 0, 1000, 'taxable', 'adm01', 'WP-35964905', 'credit', '2022-09-17 05:34:06'),
(34, 10000, 0, 0.1, 'No', 18, 0, 1000, '999 PLAN ', 'adm01', 'WP-69792248', 'credit', '2022-09-20 10:31:56'),
(35, 50000, 8752, 0.1, 'Yes', 18, 900, 5900, 'tax included', 'adm01', 'WP-19046161', 'credit', '2022-09-20 03:59:45'),
(36, 10000, 58752, 0.1, 'No', 18, 0, 1000, 'TAX INCLUDED', 'WP-19046161', 'WP-52651314', 'credit', '2022-09-20 04:02:40'),
(37, 10000, 0, 0.1, 'No', 18, 0, 1000, '999 PLAN ', 'adm01', 'WP-86490920', 'credit', '2022-09-20 04:25:24'),
(38, 10000, 0, 0.1, 'No', 18, 0, 1000, '999 PLAN ', 'adm01', 'WP-37233102', 'credit', '2022-09-20 05:41:43'),
(39, 716, 9284, 0.1, 'No', 18, 0, 71.60000000000001, 'refunding credits for accident submit', 'adm01', 'WP-86490920', 'credit', '2022-09-21 10:14:56'),
(40, 51248, 48752, 10, 'Yes', 18, 92246.4, 604726.4, 'I ADDED TARGETED SMS', 'adm01', 'WP-19046161', 'credit', '2022-09-21 10:39:44'),
(41, 95207, 4793, 10, 'Yes', 18, 171372.6, 1123442.6, 'incentice amount 10000', 'adm01', 'WP-44511432', 'credit', '2022-09-21 10:44:50'),
(42, 150000, 0, 10, 'Yes', 18, 270000, 1770000, 'TARGET CREDIT 150000', 'adm01', 'WP-70071457', 'credit', '2022-09-22 10:06:21'),
(43, 25000, 150000, 0.1, 'No', 18, 0, 2500, 'TAX INCLUDED', 'WP-70071457', 'WP-64326488', 'credit', '2022-09-22 10:37:24'),
(44, 9000, 125000, 0.1, 'No', 18, 0, 900, 'REMAINING CREDITS', 'WP-70071457', 'WP-14384841', 'credit', '2022-09-22 10:37:44'),
(45, 9284, 116000, 0.1, 'No', 18, 0, 928.4000000000001, 'TAXABLE', 'WP-70071457', 'WP-98365226', 'credit', '2022-09-22 10:44:45'),
(46, 10000, 106716, 0.1, 'No', 18, 0, 1000, 'TAXABLE', 'WP-70071457', 'WP-36404196', 'credit', '2022-09-22 10:45:05'),
(47, 10000, 96716, 0.1, 'No', 18, 0, 1000, 'TAXABLE\r\n', 'WP-70071457', 'WP-25054450', 'credit', '2022-09-22 10:47:25'),
(48, 7000, NULL, NULL, 'No', NULL, NULL, NULL, NULL, 'adm01', 'WP-37233102', 'debit', '2022-09-22 01:51:21'),
(49, 24500, NULL, NULL, 'No', NULL, NULL, NULL, NULL, 'adm01', 'WP-64326488', 'debit', '2022-09-22 01:53:23'),
(50, 8500, NULL, NULL, 'No', NULL, NULL, NULL, NULL, 'adm01', 'WP-69792248', 'debit', '2022-09-22 01:53:54'),
(51, 9999, NULL, NULL, 'No', NULL, NULL, NULL, NULL, 'adm01', 'WP-25054450', 'debit', '2022-09-22 01:54:32'),
(52, 9999, NULL, NULL, 'No', NULL, NULL, NULL, NULL, 'adm01', 'WP-36404196', 'debit', '2022-09-22 01:55:15'),
(53, 8655, NULL, NULL, 'No', NULL, NULL, NULL, NULL, 'adm01', 'WP-86490920', 'debit', '2022-09-22 01:56:02'),
(54, 39, 86716, 0.1, 'No', 18, 0, 3.9000000000000004, 'REFUNDING (NONE WHATSAPP CREDITS)', 'WP-70071457', 'WP-14384841', 'credit', '2022-09-22 04:13:32'),
(55, 228, 86677, 0.1, 'No', 18, 0, 22.8, 'REFUNDING ( NONE WHATSAPP CREDITS)', 'WP-70071457', 'WP-98365226', 'credit', '2022-09-22 04:14:06'),
(56, 150, 100000, 0.1, 'No', 18, 0, 15, 'tax included', 'WP-19046161', 'WP-11373591', 'credit', '2022-09-22 04:37:10'),
(57, 153, 99850, 0.1, 'No', 18, 0, 15.3, 'tax included', 'WP-19046161', 'WP-82602410', 'credit', '2022-09-22 05:15:49'),
(58, 211, 99697, 0.1, 'No', 18, 0, 21.1, 'tax included', 'WP-19046161', 'WP-23006920', 'credit', '2022-09-22 05:16:21'),
(59, 142, 100000, 0.1, 'No', 18, 0, 14.200000000000001, 'tax include', 'WP-44511432', 'WP-34610872', 'credit', '2022-09-22 05:34:58'),
(60, 100, 99858, 0.1, 'No', 18, 0, 10, 'tax include', 'WP-44511432', 'WP-40710615', 'credit', '2022-09-22 05:36:24'),
(61, 8537, NULL, NULL, 'No', NULL, NULL, NULL, NULL, 'WP-70071457', 'WP-14384841', 'debit', '2022-09-23 10:51:29'),
(62, 8709, NULL, NULL, 'No', NULL, NULL, NULL, NULL, 'WP-70071457', 'WP-98365226', 'debit', '2022-09-23 10:51:45'),
(63, 25000, 103695, 0.1, 'No', 18, 0, 2500, 'tax included\r\n', 'WP-70071457', 'WP-34024683', 'credit', '2022-09-23 10:57:35'),
(64, 9000, 78695, 0.1, 'No', 18, 0, 900, 'new account ', 'WP-70071457', 'WP-78991026', 'credit', '2022-09-23 10:57:57'),
(65, 8246, 69695, 0.1, 'No', 18, 0, 824.6, 'tax included', 'WP-70071457', 'WP-47492072', 'credit', '2022-09-23 10:58:21'),
(66, 10000, 61449, 0.1, 'No', 18, 0, 1000, 'tax included', 'WP-70071457', 'WP-22296371', 'credit', '2022-09-23 10:58:39'),
(67, 8500, 51449, 0.1, 'No', 18, 0, 850, 'tax included', 'WP-70071457', 'WP-52957033', 'credit', '2022-09-23 10:58:55'),
(68, 150, 99486, 0.1, 'No', 18, 0, 15, 'TAX INCLUDED', 'WP-19046161', 'WP-11373591', 'credit', '2022-09-23 03:42:09'),
(69, 300, 99336, 0.1, 'No', 18, 0, 30, 'TAX INCLUDED', 'WP-19046161', 'WP-82602410', 'credit', '2022-09-23 03:44:16'),
(70, 200, 99036, 0.1, 'No', 18, 0, 20, 'TAX INCLUDED', 'WP-19046161', 'WP-23006920', 'credit', '2022-09-23 03:46:33'),
(71, 130, 42949, 0.1, 'No', 18, 0, 13, 'REFUNDING ( FOR NONE WHATSAPP NUMBER CREDITS )', 'WP-70071457', 'WP-52957033', 'credit', '2022-09-23 03:52:27'),
(72, 144, 99258, 0.1, 'No', 18, 0, 14.4, 'refund credits', 'WP-44511432', 'WP-34610872', 'credit', '2022-09-23 04:31:16'),
(73, 103, 99114, 0.1, 'No', 18, 0, 10.3, 'refund credits', 'WP-44511432', 'WP-40710615', 'credit', '2022-09-23 04:31:38'),
(74, 195, 42819, 10, 'No', 18, 0, 1950, 'REFUNDING CREDITS ( NONE WHATSAPP MESSAGES )\r\n', 'WP-70071457', 'WP-47492072', 'credit', '2022-09-24 02:24:37'),
(75, 101, 99011, 0.1, 'No', 18, 0, 10.100000000000001, 'refund credits', 'WP-44511432', 'WP-34610872', 'credit', '2022-09-24 02:56:57'),
(76, 260, 98836, 0.1, 'No', 18, 0, 26, 'TAX INCLUDED', 'WP-19046161', 'WP-23006920', 'credit', '2022-09-24 02:57:29'),
(77, 100, 98910, 0.1, 'No', 18, 0, 10, 'refund credits', 'WP-44511432', 'WP-40710615', 'credit', '2022-09-24 02:57:44'),
(78, 500, NULL, NULL, 'No', NULL, NULL, NULL, NULL, 'WP-19046161', 'WP-82602410', 'debit', '2022-09-24 03:00:53'),
(79, 500, NULL, NULL, 'No', NULL, NULL, NULL, NULL, 'WP-19046161', 'WP-82602410', 'debit', '2022-09-24 03:01:44'),
(80, 300, NULL, NULL, 'No', NULL, NULL, NULL, NULL, 'WP-19046161', 'WP-23006920', 'debit', '2022-09-24 03:04:01'),
(81, 833, 99876, 0.1, 'No', 18, 0, 83.30000000000001, 'TAX INCLUDED', 'WP-19046161', 'WP-52651314', 'credit', '2022-09-24 03:05:37'),
(82, 40, NULL, NULL, 'No', NULL, NULL, NULL, NULL, 'WP-19046161', 'WP-82602410', 'debit', '2022-09-24 03:07:03'),
(83, 95, 42624, 10, 'No', 18, 0, 950, 'REFUNDING CREDITS ( FOR NONE WHATSAPP NO)', 'WP-70071457', 'WP-52957033', 'credit', '2022-09-24 05:34:00'),
(84, 10000, 98760, 0.1, 'No', 18, 0, 1000, 'TAX INCLUDED', 'WP-19046161', 'WP-55217287', 'credit', '2022-09-25 12:16:46'),
(85, 10000, 98810, 0.1, 'No', 18, 0, 1000, 'TAX INCUDED', 'WP-44511432', 'WP-77953628', 'credit', '2022-09-26 11:32:01'),
(86, 234, 42529, 10, 'No', 18, 0, 2340, 'REFUNDING(NONE WHATSAPP CREDITS)', 'WP-70071457', 'WP-47492072', 'credit', '2022-09-26 12:52:07'),
(87, 111, 88810, 0.1, 'No', 18, 0, 11.100000000000001, 'REFUND CREDITS', 'WP-44511432', 'WP-40710615', 'credit', '2022-09-26 12:54:32'),
(88, 162, 88699, 0.1, 'No', 18, 0, 16.2, 'REFUND CREDITS', 'WP-44511432', 'WP-34610872', 'credit', '2022-09-26 12:55:35'),
(89, 210, 88760, 0.1, 'No', 18, 0, 21, 'TAX INCLUDED', 'WP-19046161', 'WP-82602410', 'credit', '2022-09-26 12:58:45'),
(90, 170, 88550, 0.1, 'No', 18, 0, 17, 'TAX INCLUDED', 'WP-19046161', 'WP-11373591', 'credit', '2022-09-26 12:59:03'),
(91, 20, 42295, 10, 'No', 18, 0, 200, 'for demo ', 'WP-70071457', 'WP-89401193', 'credit', '2022-09-26 03:05:16'),
(92, 280, 42275, 10, 'No', 18, 0, 2800, 'for demo', 'WP-70071457', 'WP-89401193', 'credit', '2022-09-26 03:45:43'),
(93, 10000, 88537, 0.1, 'No', 18, 0, 1000, 'TAX INCLUDED', 'WP-44511432', 'WP-57854274', 'credit', '2022-09-26 04:21:47'),
(94, 93, 88380, 0.1, 'No', 18, 0, 9.3, 'TAX INCLUDED', 'WP-19046161', 'WP-55217287', 'credit', '2022-09-26 04:25:01'),
(95, 100, 88287, 0.1, 'No', 18, 0, 10, 'TAX INCLUDED', 'WP-19046161', 'WP-23006920', 'credit', '2022-09-26 04:25:24'),
(96, 500, 88187, 0.1, 'No', 18, 0, 50, 'TAX INCLUDED', 'WP-19046161', 'WP-52651314', 'credit', '2022-09-26 05:29:18'),
(97, 25000, 87687, 0.1, 'No', 18, 0, 2500, 'TAX INCLUDED', 'WP-19046161', 'WP-59137638', 'credit', '2022-09-27 09:55:37'),
(98, 24999, NULL, NULL, 'No', NULL, NULL, NULL, NULL, 'WP-19046161', 'WP-59137638', 'debit', '2022-09-27 10:18:08'),
(99, 25000, 87686, 0.1, 'No', 18, 0, 2500, 'TAX INCLUDED', 'WP-19046161', 'WP-68418273', 'credit', '2022-09-27 10:22:47'),
(100, 25000, 41995, 10, 'No', 18, 0, 250000, 'TAX INCLUDED', 'WP-70071457', 'WP-89401193', 'credit', '2022-09-27 10:41:24'),
(101, 104, 62686, 0.1, 'No', 18, 0, 10.4, 'TAX INCLUDED', 'WP-19046161', 'WP-55217287', 'credit', '2022-09-27 12:24:20'),
(102, 54, 78537, 0.1, 'No', 18, 0, 5.4, 'REFUND CREDITS', 'WP-44511432', 'WP-40710615', 'credit', '2022-09-27 12:44:57'),
(103, 167, 62582, 0.1, 'No', 18, 0, 16.7, 'TAX INCLUDED', 'WP-19046161', 'WP-82602410', 'credit', '2022-09-27 01:01:52'),
(104, 175, 16995, 10, 'No', 18, 0, 1750, 'REFUNDING FAILES MESSAGES', 'WP-70071457', 'WP-47492072', 'credit', '2022-09-27 01:43:53'),
(105, 3, 16820, 10, 'No', 18, 0, 30, 'REFUNDING FAILED CREDITS', 'WP-70071457', 'WP-89401193', 'credit', '2022-09-27 01:44:26'),
(106, 3, 16817, 10, 'No', 18, 0, 30, 'REFUNDING FAILED CREDITS', 'WP-70071457', 'WP-89401193', 'credit', '2022-09-27 01:44:44'),
(107, 142, 78483, 0.1, 'No', 18, 0, 14.200000000000001, 'REFUND CREDITS', 'WP-44511432', 'WP-34610872', 'credit', '2022-09-27 03:10:56'),
(108, 102, 62415, 0.1, 'No', 18, 0, 10.200000000000001, 'TAX INCLUDED', 'WP-19046161', 'WP-68418273', 'credit', '2022-09-27 04:08:06'),
(109, 79, 62313, 0.1, 'No', 18, 0, 7.9, 'TAX INCLUDED', 'WP-19046161', 'WP-77448271', 'credit', '2022-09-27 04:21:21'),
(110, 90, 62234, 0.1, 'No', 18, 0, 9, 'TAX INCLUDED', 'WP-19046161', 'WP-23006920', 'credit', '2022-09-27 04:49:54'),
(111, 108, 62144, 0.1, 'No', 18, 0, 10.8, 'tax included', 'WP-19046161', 'WP-52651314', 'credit', '2022-09-27 05:28:00'),
(112, 56, 16814, 10, 'No', 18, 0, 560, 'REFUNDING CREDITS\r\n', 'WP-70071457', 'WP-78991026', 'credit', '2022-09-27 05:39:01'),
(113, 1000, 16758, 10, 'No', 18, 0, 10000, 'REFUNDING ACCIDENT REQUEST', 'WP-70071457', 'WP-89401193', 'credit', '2022-09-28 10:06:07'),
(114, 148, NULL, NULL, 'No', NULL, NULL, NULL, NULL, 'WP-70071457', 'WP-89401193', 'debit', '2022-09-28 10:13:18'),
(115, 76, 15906, 10, 'No', 18, 0, 760, 'REFUNDING (NONE WHATSAPP NUMBERS )', 'WP-70071457', 'WP-52957033', 'credit', '2022-09-28 11:04:59'),
(116, 71, 78341, 0.1, 'No', 18, 0, 7.1000000000000005, 'REFUND CREDITS', 'WP-44511432', 'WP-40710615', 'credit', '2022-09-28 11:08:40'),
(117, 160, 78270, 0.1, 'No', 18, 0, 16, 'REFUND CREDITS', 'WP-44511432', 'WP-34610872', 'credit', '2022-09-28 11:17:24'),
(118, 100, 62036, 0.1, 'No', 18, 0, 10, 'TAX INCLUDED', 'WP-19046161', 'WP-55217287', 'credit', '2022-09-28 11:24:42'),
(119, 144, 61936, 0.1, 'No', 18, 0, 14.4, 'TAX INCLUDED', 'WP-19046161', 'WP-68418273', 'credit', '2022-09-28 11:27:39'),
(120, 176, 61792, 0.1, 'No', 18, 0, 17.6, 'TAX INCLUDED', 'WP-19046161', 'WP-82602410', 'credit', '2022-09-28 11:37:23'),
(121, 185, 15830, 10, 'No', 18, 0, 1850, 'REFUNDING (NONE WHATSAPP CTREDITS)', 'WP-70071457', 'WP-47492072', 'credit', '2022-09-28 11:48:18'),
(122, 9999, NULL, NULL, 'No', NULL, NULL, NULL, NULL, 'adm01', 'WP-22296371', 'debit', '2022-09-28 11:53:38'),
(123, 10000, 15645, 10, 'Yes', 18, 18000, 118000, 'MODALING PAINATING ENTERED TWO TIMES WE REMOVE THAT CREDITS AND TO SAALAMON ACCOUNT', 'adm01', 'WP-70071457', 'credit', '2022-09-28 11:57:25'),
(124, 10000, 25645, 10, 'No', 18, 0, 100000, 'RECREATED AND RE CREDITED', 'WP-70071457', 'WP-82519012', 'credit', '2022-09-28 12:10:33'),
(125, 75, 61616, 0.1, 'No', 18, 0, 7.5, 'TAX INCLUDED', 'WP-19046161', 'WP-77448271', 'credit', '2022-09-28 12:20:05'),
(126, 201, 15645, 10, 'No', 18, 0, 2010, 'REFUNDING FAILED MESSAGES', 'WP-70071457', 'WP-47492072', 'credit', '2022-09-28 02:07:07'),
(127, 20, 15444, 10, 'No', 18, 0, 200, 'REFUNDING FAILED NO', 'WP-70071457', 'WP-89401193', 'credit', '2022-09-28 02:07:35'),
(128, 56, 15424, 10, 'No', 18, 0, 560, 'REFUNDING FAILED NUMBERS', 'WP-70071457', 'WP-89401193', 'credit', '2022-09-28 02:08:38'),
(129, 184, 61541, 0.1, 'No', 18, 0, 18.400000000000002, 'TAX INCLUDED', 'WP-19046161', 'WP-23006920', 'credit', '2022-09-28 04:09:55'),
(130, 137, 78110, 0.1, 'No', 18, 0, 13.700000000000001, 'refund credits', 'WP-44511432', 'WP-77953628', 'credit', '2022-09-28 05:21:06'),
(131, 250000, 0, 10, 'Yes', 18, 450000, 2950000, '250000 credit added to mohan', 'adm01', 'WP-12036482', 'credit', '2022-09-29 08:41:39'),
(132, 38, 15368, 10, 'No', 18, 0, 380, 'REFUNDING NONE WHATSAPP CREDITS', 'WP-70071457', 'WP-82519012', 'credit', '2022-09-29 12:06:34'),
(133, 13, 15330, 10, 'No', 18, 0, 130, 'REFUNDING NONE WHATSAPP NUMBERS \r\n', 'WP-70071457', 'WP-89401193', 'credit', '2022-09-29 12:09:07'),
(134, 84, 15317, 10, 'No', 18, 0, 840, 'REFUNDING NONE WHATSAPP NUMBERS ', 'WP-70071457', 'WP-47492072', 'credit', '2022-09-29 12:11:45'),
(135, 64, 61357, 0.1, 'No', 18, 0, 6.4, 'TAX INCLUDED', 'WP-19046161', 'WP-55217287', 'credit', '2022-09-29 12:41:56'),
(136, 195, 61293, 0.1, 'No', 18, 0, 19.5, 'TAX INCLUDED', 'WP-19046161', 'WP-82602410', 'credit', '2022-09-29 01:14:43'),
(137, 149, 61098, 0.1, 'No', 18, 0, 14.9, 'TAX INCLUDED', 'WP-19046161', 'WP-23006920', 'credit', '2022-09-29 01:16:25'),
(138, 40, 77973, 0.1, 'No', 18, 0, 4, 'REFUND CREDITS', 'WP-44511432', 'WP-40710615', 'credit', '2022-09-29 04:08:11'),
(139, 117, 77933, 0.1, 'No', 18, 0, 11.700000000000001, 'REFUND CREDITS', 'WP-44511432', 'WP-34610872', 'credit', '2022-09-29 04:08:37'),
(140, 166, 60949, 0.1, 'No', 18, 0, 16.6, 'TAX INCLUDED', 'WP-19046161', 'WP-68418273', 'credit', '2022-09-29 05:05:59'),
(141, 175, 60783, 0.1, 'No', 18, 0, 17.5, 'TAX INCLUDED', 'WP-19046161', 'WP-52651314', 'credit', '2022-09-29 05:19:19'),
(142, 186, 15233, 10, 'No', 18, 0, 1860, 'REFUNDING FAILES TO SEND NONE WHATSAPP NUMBERS', 'WP-70071457', 'WP-47492072', 'credit', '2022-09-30 10:48:36'),
(143, 60, 60608, 0.1, 'No', 18, 0, 6, 'TAX INCLUDED', 'WP-19046161', 'WP-23006920', 'credit', '2022-09-30 03:12:17'),
(144, 6, 15047, 10, 'No', 18, 0, 60, 'REFUNDING FAILED TO SEND NONE WHATSAPP NUMBERS\r\n', 'WP-70071457', 'WP-82519012', 'credit', '2022-09-30 03:15:44'),
(145, 95, 60548, 0.1, 'No', 18, 0, 9.5, 'TAX INCLUDED', 'WP-19046161', 'WP-82602410', 'credit', '2022-09-30 03:49:11'),
(146, 87, 60453, 0.1, 'No', 18, 0, 8.700000000000001, 'TAX INCLUDED', 'WP-19046161', 'WP-55217287', 'credit', '2022-09-30 04:47:54'),
(147, 147, 60366, 0.1, 'No', 18, 0, 14.700000000000001, 'TAX INCLUDED', 'WP-19046161', 'WP-52651314', 'credit', '2022-09-30 05:28:33'),
(148, 120, 15041, 10, 'No', 18, 0, 1200, 'REFUNDING FAILED TO SEND NONE WHATSAPP NUMBERS ', 'WP-70071457', 'WP-47492072', 'credit', '2022-10-01 01:31:05'),
(149, 186, 14921, 10, 'No', 18, 0, 1860, 'REFUNDING FAILED TO SEND NONE WHATSAPP NUMBERS ', 'WP-70071457', 'WP-47492072', 'credit', '2022-10-01 01:31:41'),
(150, 7, 14735, 10, 'No', 18, 0, 70, 'REFUNDING SEND TO FAILED TO SEND MESSAGES', 'WP-70071457', 'WP-89401193', 'credit', '2022-10-01 01:54:11'),
(151, 5, 14728, 10, 'No', 18, 0, 50, 'REFUNDING FAILED TO SEND NONE WHATSAPP NUMBERS \r\n', 'WP-70071457', 'WP-89401193', 'credit', '2022-10-01 03:32:12'),
(152, 75, 14723, 10, 'No', 18, 0, 750, 'REFUNDING FAILED TO SEND NONE WHATSAPP NUMBERS ', 'WP-70071457', 'WP-82519012', 'credit', '2022-10-01 03:34:09'),
(153, 9, 14648, 10, 'No', 18, 0, 90, 'REFUNDING CREDITS FAILED TO SEND MESSAGE', 'WP-70071457', 'WP-89401193', 'credit', '2022-10-01 04:35:03'),
(154, 106, 14639, 10, 'No', 18, 0, 1060, 'REFUNDING FAILED TO SEND NONE WHATSAPP NUMBERS ', 'WP-70071457', 'WP-47492072', 'credit', '2022-10-03 11:30:36'),
(155, 15, 14533, 10, 'No', 18, 0, 150, 'REFUMDING FAILES TO SEND NONE WHATSAPP NUMBERS +\r\n', 'WP-70071457', 'WP-89401193', 'credit', '2022-10-03 12:10:05'),
(156, 12, 14518, 10, 'No', 18, 0, 120, 'REFUNDING FAILED TO SEND NONE WHATSAPP NUMBERS', 'WP-70071457', 'WP-89401193', 'credit', '2022-10-03 01:27:25'),
(157, 72000, 250000, 10, 'No', 18, 0, 720000, 'old applications', 'WP-12036482', 'WP-85116414', 'credit', '2022-10-03 02:20:26'),
(158, 158, 60219, 0.1, 'No', 18, 0, 15.8, 'TAX INCLUDED', 'WP-19046161', 'WP-68418273', 'credit', '2022-10-03 05:30:14'),
(159, 188, 60061, 0.1, 'No', 18, 0, 18.8, 'TAX INCLUDED', 'WP-19046161', 'WP-52651314', 'credit', '2022-10-03 05:35:13'),
(160, 127, 59873, 0.1, 'No', 18, 0, 12.700000000000001, 'tax included', 'WP-19046161', 'WP-52651314', 'credit', '2022-10-04 12:36:20'),
(161, 124, 59746, 0.1, 'No', 18, 0, 12.4, 'tax included', 'WP-19046161', 'WP-55217287', 'credit', '2022-10-04 12:39:25'),
(162, 114, 59622, 0.1, 'No', 18, 0, 11.4, 'TAX INCLUDED', 'WP-19046161', 'WP-23006920', 'credit', '2022-10-05 09:55:04'),
(163, 210, 14506, 10, 'No', 18, 0, 2100, 'REFUNDING FAILED TO SEND MESSAGES', 'WP-70071457', 'WP-47492072', 'credit', '2022-10-05 11:09:01'),
(164, 85, 14296, 10, 'No', 18, 0, 850, 'REFUNDING FAILED TO SEND MESSAGSES', 'WP-70071457', 'WP-82519012', 'credit', '2022-10-05 11:09:34'),
(165, 50, 59508, 0.1, 'No', 18, 0, 5, 'TAX INCLUDED', 'WP-19046161', 'WP-82602410', 'credit', '2022-10-05 01:04:28'),
(166, 114, 59458, 0.1, 'No', 18, 0, 11.4, 'TAX INCLUDED', 'WP-19046161', 'WP-82602410', 'credit', '2022-10-05 01:05:21'),
(167, 138, 59344, 0.1, 'No', 18, 0, 13.8, 'TAX INCLUDED', 'WP-19046161', 'WP-11373591', 'credit', '2022-10-05 01:12:05'),
(168, 10, 14211, 0.1, 'No', 18, 0, 1, 'TAX INCLUDED', 'WP-70071457', 'WP-45237319', 'credit', '2022-10-05 02:08:36'),
(169, 117, 59206, 0.1, 'No', 18, 0, 11.700000000000001, 'TAX INCLUDED', 'WP-19046161', 'WP-23006920', 'credit', '2022-10-05 02:26:42'),
(170, 182, 59089, 0.1, 'No', 18, 0, 18.2, 'TAX INCLUDED', 'WP-19046161', 'WP-52651314', 'credit', '2022-10-05 03:15:00'),
(171, 161, 58907, 0.1, 'No', 18, 0, 16.1, 'TAX INCLUDED', 'WP-19046161', 'WP-52651314', 'credit', '2022-10-06 09:21:48'),
(172, 54, 14201, 10, 'No', 18, 0, 540, 'refunding failed to send none whatsapp numbers\r\n', 'WP-70071457', 'WP-89401193', 'credit', '2022-10-06 10:41:51'),
(173, 94, 58746, 0.1, 'No', 18, 0, 9.4, 'tax included', 'WP-19046161', 'WP-55217287', 'credit', '2022-10-06 11:12:07'),
(174, 65, 14147, 10, 'No', 18, 0, 650, 'refunding failed to send none whatsapp numbers', 'WP-70071457', 'WP-47492072', 'credit', '2022-10-06 11:30:33'),
(175, 22, 14082, 10, 'No', 18, 0, 220, 'refunding none whatsapp nbumbers credits', 'WP-70071457', 'WP-89401193', 'credit', '2022-10-06 12:15:34'),
(176, 15, 14060, 10, 'No', 18, 0, 150, 'REFUNDING FAILED TO SEND NONE WHATSAPP NUMBERS\r\n', 'WP-70071457', 'WP-89401193', 'credit', '2022-10-06 12:44:09'),
(177, 23, 14045, 10, 'No', 18, 0, 230, 'refunding failed to send none whatsapp numbers ', 'WP-70071457', 'WP-82519012', 'credit', '2022-10-06 01:25:19'),
(178, 68, 58652, 0.1, 'No', 18, 0, 6.800000000000001, 'tax included', 'WP-19046161', 'WP-23006920', 'credit', '2022-10-06 01:57:04'),
(179, 184, 58584, 0.1, 'No', 18, 0, 18.400000000000002, 'tax included', 'WP-19046161', 'WP-68418273', 'credit', '2022-10-06 02:30:07'),
(180, 58, 58400, 0.1, 'No', 18, 0, 5.800000000000001, 'TAX INCLUDED', 'WP-19046161', 'WP-82602410', 'credit', '2022-10-06 03:38:25'),
(181, 57, 58342, 0.1, 'No', 18, 0, 5.7, 'tax included', 'WP-19046161', 'WP-82602410', 'credit', '2022-10-07 12:20:43'),
(182, 161, 58285, 0.1, 'No', 18, 0, 16.1, 'TAX INCLUDED', 'WP-19046161', 'WP-68418273', 'credit', '2022-10-07 02:08:53'),
(183, 69, 58124, 0.1, 'No', 18, 0, 6.9, 'TAX INCLUDED', 'WP-19046161', 'WP-55217287', 'credit', '2022-10-07 03:18:34'),
(184, 30, 58055, 0.1, 'No', 18, 0, 3, 'tax included', 'WP-19046161', 'WP-23006920', 'credit', '2022-10-07 04:45:13'),
(185, 44, 58025, 0.1, 'No', 18, 0, 4.4, 'tax included', 'WP-19046161', 'WP-23006920', 'credit', '2022-10-07 04:45:40'),
(186, 59, 14022, 10, 'No', 18, 0, 590, 'REFUNDING FAILED TO SEND NONE WHATSAPP NUMBERS', 'WP-70071457', 'WP-47492072', 'credit', '2022-10-07 05:01:55'),
(187, 46, 13963, 10, 'No', 18, 0, 460, 'REFUNDING FAILED TO SEND NONE WHATSAPP NUMBERS ', 'WP-70071457', 'WP-82519012', 'credit', '2022-10-07 05:27:15'),
(188, 57, 57981, 0.1, 'No', 18, 0, 5.7, 'TAX INCLUDED', 'WP-19046161', 'WP-55217287', 'credit', '2022-10-08 10:56:03'),
(189, 33, 57924, 0.1, 'No', 18, 0, 3.3000000000000003, 'TAX INCLUDED', 'WP-19046161', 'WP-23006920', 'credit', '2022-10-08 10:59:17'),
(190, 93, 57891, 0.1, 'No', 18, 0, 9.3, 'TAX INCLUDED', 'WP-19046161', 'WP-55217287', 'credit', '2022-10-08 12:05:17'),
(191, 25, 13917, 10, 'No', 18, 0, 250, 'REFUNDING FAILED TO SEND MESSAGES', 'WP-70071457', 'WP-89401193', 'credit', '2022-10-08 01:46:57'),
(192, 107, 57798, 0.1, 'No', 18, 0, 10.700000000000001, 'tax included', 'WP-19046161', 'WP-68418273', 'credit', '2022-10-08 02:34:50'),
(193, 16, 13892, 10, 'No', 18, 0, 160, 'REFUNDING FAILED TO SEND MESSAGES', 'WP-70071457', 'WP-89401193', 'credit', '2022-10-08 03:38:52'),
(194, 59, 13876, 10, 'No', 18, 0, 590, 'REFUNDING FAILED TO NONE WHATSAPP NUMBERS', 'WP-70071457', 'WP-78991026', 'credit', '2022-10-10 01:51:54'),
(195, 123, 57691, 0.1, 'No', 18, 0, 12.3, 'tax included', 'WP-19046161', 'WP-55217287', 'credit', '2022-10-10 02:11:02'),
(196, 26, 13817, 10, 'No', 18, 0, 260, 'refunding failed to send messages', 'WP-70071457', 'WP-89401193', 'credit', '2022-10-10 04:59:09'),
(197, 127, 57568, 0.1, 'No', 18, 0, 12.700000000000001, 'tax included', 'WP-19046161', 'WP-68418273', 'credit', '2022-10-10 05:12:39'),
(198, 866, 57441, 0.1, 'No', 18, 0, 86.60000000000001, 'tax included', 'WP-19046161', 'WP-55217287', 'credit', '2022-10-10 05:13:23'),
(199, 38, 13791, 10, 'No', 18, 0, 380, 'refunding failed to send none whatsapp numbers ', 'WP-70071457', 'WP-89401193', 'credit', '2022-10-10 05:54:25'),
(200, 52, 13753, 10, 'No', 18, 0, 520, 'REFUNDING FAILED TO SEND NONE WHATSAPP NUMBERS', 'WP-70071457', 'WP-82519012', 'credit', '2022-10-11 10:37:39'),
(201, 18, 13701, 10, 'No', 18, 0, 180, 'REFUNDING FAILED SEND MESSAGES', 'WP-70071457', 'WP-89401193', 'credit', '2022-10-11 12:47:25'),
(202, 13, 13683, 10, 'No', 18, 0, 130, 'REFUNDING FAILED TO SEND MESSAGES', 'WP-70071457', 'WP-89401193', 'credit', '2022-10-11 01:28:04'),
(203, 71, 56575, 0.1, 'No', 18, 0, 7.1000000000000005, 'tax included', 'WP-19046161', 'WP-11373591', 'credit', '2022-10-11 01:35:40'),
(204, 148, 56504, 0.1, 'No', 18, 0, 14.8, 'tax included', 'WP-19046161', 'WP-68418273', 'credit', '2022-10-11 02:16:59'),
(205, 82, 56356, 0.1, 'No', 18, 0, 8.200000000000001, 'TAX INCLUDED', 'WP-19046161', 'WP-68418273', 'credit', '2022-10-11 04:44:17'),
(206, 100, 13670, 10, 'No', 18, 0, 1000, 'FAILED TO SEND NONE WHATSAPP NUMBERS', 'WP-70071457', 'WP-78991026', 'credit', '2022-10-11 05:07:41'),
(207, 89, 56274, 0.1, 'No', 18, 0, 8.9, 'tax included', 'WP-19046161', 'WP-55217287', 'credit', '2022-10-12 11:44:23'),
(208, 201, 13570, 10, 'No', 18, 0, 2010, 'REFUNDING FAILED TO SEND MESSAGES', 'WP-70071457', 'WP-78991026', 'credit', '2022-10-12 02:00:23'),
(209, 136, 56185, 0.1, 'No', 18, 0, 13.600000000000001, 'tax included', 'WP-19046161', 'WP-77448271', 'credit', '2022-10-12 02:19:57'),
(210, 55, 56049, 0.1, 'No', 18, 0, 5.5, 'TAX INCLUDED', 'WP-19046161', 'WP-52651314', 'credit', '2022-10-12 03:24:20'),
(211, 30, 55994, 0.1, 'No', 18, 0, 3, 'tax included', 'WP-19046161', 'WP-52651314', 'credit', '2022-10-12 03:57:49'),
(212, 253, 13369, 10, 'No', 18, 0, 2530, 'REFUNDING FAILED TO SEND NONE WHATSAPP NUMBERS', 'WP-70071457', 'WP-78991026', 'credit', '2022-10-12 03:59:42'),
(213, 144, 55964, 0.1, 'No', 18, 0, 14.4, 'TAX INCLUDED', 'WP-19046161', 'WP-52651314', 'credit', '2022-10-12 04:45:02'),
(214, 189, 13116, 10, 'No', 18, 0, 1890, 'REFUNDING FAILED TO SEND NONE WHATSAPP NUMBERS', 'WP-70071457', 'WP-78991026', 'credit', '2022-10-12 04:50:34'),
(215, 10, 12927, 10, 'No', 18, 0, 100, 'REFUNDING FAILED TO SEND NONE WHATSAPP NUMBERS\r\n', 'WP-70071457', 'WP-89401193', 'credit', '2022-10-12 04:52:26'),
(216, 19, 12917, 10, 'No', 18, 0, 190, 'REFUNDING FAILED TO SEND NONE WHATSAPP NUMBERS', 'WP-70071457', 'WP-89401193', 'credit', '2022-10-12 04:53:00'),
(217, 402, 55820, 0.1, 'No', 18, 0, 40.2, 'TAX INCLUDED', 'WP-19046161', 'WP-11373591', 'credit', '2022-10-13 09:45:17'),
(218, 14, 12898, 10, 'No', 18, 0, 140, 'refunding failed to send none whatsapp numbers', 'WP-70071457', 'WP-89401193', 'credit', '2022-10-13 12:05:18'),
(219, 198, 55418, 0.1, 'No', 18, 0, 19.8, 'TAX INCLUDED', 'WP-19046161', 'WP-11373591', 'credit', '2022-10-13 01:44:20'),
(220, 137, 55220, 0.1, 'No', 18, 0, 13.700000000000001, 'TAX INCLUDED', 'WP-19046161', 'WP-77448271', 'credit', '2022-10-13 01:48:14'),
(221, 106, 55083, 0.1, 'No', 18, 0, 10.600000000000001, 'TAX INCLUDED', 'WP-19046161', 'WP-55217287', 'credit', '2022-10-13 05:16:45'),
(222, 18742, NULL, NULL, 'No', NULL, NULL, NULL, NULL, 'WP-19046161', 'WP-68418273', 'debit', '2022-10-14 11:33:29'),
(223, 2996, NULL, NULL, 'No', NULL, NULL, NULL, NULL, 'WP-19046161', 'WP-55217287', 'debit', '2022-10-14 11:34:24'),
(224, 1373, NULL, NULL, 'No', NULL, NULL, NULL, NULL, 'WP-19046161', 'WP-52651314', 'debit', '2022-10-14 11:35:09'),
(225, 4014, NULL, NULL, 'No', NULL, NULL, NULL, NULL, 'WP-19046161', 'WP-11373591', 'debit', '2022-10-14 11:36:02'),
(226, 29445, NULL, NULL, 'No', NULL, NULL, NULL, NULL, 'WP-19046161', 'WP-77448271', 'debit', '2022-10-14 11:36:55'),
(227, 7499, NULL, NULL, 'No', NULL, NULL, NULL, NULL, 'WP-19046161', 'WP-26976349', 'debit', '2022-10-14 11:37:29'),
(228, 10999, NULL, NULL, 'No', NULL, NULL, NULL, NULL, 'WP-19046161', 'WP-68682966', 'debit', '2022-10-14 11:38:08'),
(229, 2985, NULL, NULL, 'No', NULL, NULL, NULL, NULL, 'WP-44511432', 'WP-57854274', 'debit', '2022-10-14 11:39:56'),
(230, 3626, NULL, NULL, 'No', NULL, NULL, NULL, NULL, 'WP-44511432', 'WP-77953628', 'debit', '2022-10-14 11:40:22'),
(231, 6500, NULL, NULL, 'No', NULL, NULL, NULL, NULL, 'WP-44511432', 'WP-34610872', 'debit', '2022-10-14 11:40:46'),
(232, 806, NULL, NULL, 'No', NULL, NULL, NULL, NULL, 'WP-44511432', 'WP-40710615', 'debit', '2022-10-14 11:41:09'),
(233, 4006, NULL, NULL, 'No', NULL, NULL, NULL, NULL, 'WP-70071457', 'WP-82519012', 'debit', '2022-10-14 11:43:28'),
(234, 9392, NULL, NULL, 'No', NULL, NULL, NULL, NULL, 'WP-70071457', 'WP-89401193', 'debit', '2022-10-14 11:44:07'),
(235, 24999, NULL, NULL, 'No', NULL, NULL, NULL, NULL, 'WP-70071457', 'WP-34024683', 'debit', '2022-10-14 11:44:39'),
(236, 5808, NULL, NULL, 'No', NULL, NULL, NULL, NULL, 'WP-70071457', 'WP-78991026', 'debit', '2022-10-14 11:45:17'),
(237, 123, NULL, NULL, 'No', NULL, NULL, NULL, NULL, 'WP-70071457', 'WP-47492072', 'debit', '2022-10-14 11:46:11'),
(238, 7292, NULL, NULL, 'No', NULL, NULL, NULL, NULL, 'WP-70071457', 'WP-52957033', 'debit', '2022-10-14 11:46:54'),
(239, 64503, NULL, NULL, 'No', NULL, NULL, NULL, NULL, 'adm01', 'WP-70071457', 'debit', '2022-10-14 11:50:11'),
(240, 130044, NULL, NULL, 'No', NULL, NULL, NULL, NULL, 'adm01', 'WP-19046161', 'debit', '2022-10-14 11:51:35'),
(241, 91732, NULL, NULL, 'No', NULL, NULL, NULL, NULL, 'adm01', 'WP-44511432', 'debit', '2022-10-14 11:52:00'),
(242, 286299, 0, 10, 'No', 18, 0, 2862990, 'ALL USERS AND RESELLERS CREDITS WERE REVERTED AND ADDED', 'adm01', 'WP-94197586', 'credit', '2022-10-14 11:54:00'),
(243, 64510, 286299, 10, 'Yes', 18, 116118, 761218, 'Panel Changing Refund', 'WP-94197586', 'WP-11689852', 'credit', '2022-10-14 12:37:40'),
(244, 91737, 221789, 10, 'Yes', 18, 165126.6, 1082496.6, 'Panel changing Refund', 'WP-94197586', 'WP-65546915', 'credit', '2022-10-14 12:38:11'),
(245, 130051, 130052, 10, 'Yes', 18, 234091.8, 1534601.8, 'Panel Changing Refund', 'WP-94197586', 'WP-57872383', 'credit', '2022-10-14 12:38:36'),
(246, 11000, 130051, 0.1, 'No', 18, 0, 1100, 'TAX INCLUDED', 'WP-57872383', 'WP-80128555', 'credit', '2022-10-14 12:41:56'),
(247, 7500, 119051, 0.1, 'No', 18, 0, 750, 'TAX INCLUDED', 'WP-57872383', 'WP-47753135', 'credit', '2022-10-14 12:43:48'),
(248, 29446, 111551, 0.1, 'No', 18, 0, 2944.6000000000004, 'TAX INCLUDED', 'WP-57872383', 'WP-26637953', 'credit', '2022-10-14 12:46:54'),
(249, 4015, 82105, 0.1, 'No', 18, 0, 401.5, 'TAX INCLUDED', 'WP-57872383', 'WP-78294020', 'credit', '2022-10-14 12:48:12'),
(250, 2997, 78090, 0.1, 'No', 18, 0, 299.7, 'TAX INCLUDED', 'WP-57872383', 'WP-30373817', 'credit', '2022-10-14 12:49:35'),
(251, 1374, 75093, 0.1, 'No', 18, 0, 137.4, 'TAX INCLUDED', 'WP-57872383', 'WP-94642953', 'credit', '2022-10-14 12:50:39'),
(252, 18743, 73719, 0.1, 'No', 18, 0, 1874.3000000000002, 'TAX INCLUDED', 'WP-57872383', 'WP-54050252', 'credit', '2022-10-14 12:52:37'),
(253, 91736, NULL, NULL, 'No', NULL, NULL, NULL, NULL, 'WP-94197586', 'WP-65546915', 'debit', '2022-10-14 01:54:58'),
(254, 10999, NULL, NULL, 'No', NULL, NULL, NULL, NULL, 'WP-57872383', 'WP-80128555', 'debit', '2022-10-14 02:08:24'),
(255, 7499, NULL, NULL, 'No', NULL, NULL, NULL, NULL, 'WP-57872383', 'WP-47753135', 'debit', '2022-10-14 02:08:47'),
(256, 29445, NULL, NULL, 'No', NULL, NULL, NULL, NULL, 'WP-57872383', 'WP-26637953', 'debit', '2022-10-14 02:09:08'),
(257, 4014, NULL, NULL, 'No', NULL, NULL, NULL, NULL, 'WP-57872383', 'WP-78294020', 'debit', '2022-10-14 02:09:26'),
(258, 2996, NULL, NULL, 'No', NULL, NULL, NULL, NULL, 'WP-57872383', 'WP-30373817', 'debit', '2022-10-14 02:09:52'),
(259, 1373, NULL, NULL, 'No', NULL, NULL, NULL, NULL, 'WP-57872383', 'WP-94642953', 'debit', '2022-10-14 02:10:09'),
(260, 18742, NULL, NULL, 'No', NULL, NULL, NULL, NULL, 'WP-57872383', 'WP-54050252', 'debit', '2022-10-14 02:10:27'),
(261, 11000, 130044, 0.1, 'No', 18, 0, 1100, 'tax included', 'WP-57872383', 'WP-96632879', 'credit', '2022-10-14 02:42:25'),
(262, 7500, 119044, 0.1, 'No', 18, 0, 750, 'tax included', 'WP-57872383', 'WP-45126928', 'credit', '2022-10-14 02:42:45'),
(263, 18743, 111544, 0.1, 'No', 18, 0, 1874.3000000000002, 'tax included', 'WP-57872383', 'WP-60736254', 'credit', '2022-10-14 02:43:53'),
(264, 29446, 92801, 0.1, 'No', 18, 0, 2944.6000000000004, 'tax included', 'WP-57872383', 'WP-63419477', 'credit', '2022-10-14 02:44:44'),
(265, 4014, 63355, 0.1, 'No', 18, 0, 401.40000000000003, 'tax included', 'WP-57872383', 'WP-31114354', 'credit', '2022-10-14 02:45:11'),
(266, 2997, 59341, 0.1, 'No', 18, 0, 299.7, 'tax included', 'WP-57872383', 'WP-31584474', 'credit', '2022-10-14 02:45:33'),
(267, 1374, 56344, 0.1, 'No', 18, 0, 137.4, 'tax included', 'WP-57872383', 'WP-84330483', 'credit', '2022-10-14 02:45:54'),
(268, 215, 54970, 0.1, 'No', 18, 0, 21.5, 'tax included', 'WP-57872383', 'WP-84330483', 'credit', '2022-10-14 02:48:26'),
(269, 101, 54755, 0.1, 'No', 18, 0, 10.100000000000001, 'TAX INCLUDED', 'WP-57872383', 'WP-31584474', 'credit', '2022-10-14 02:52:25'),
(270, 91736, 91737, 10, 'Yes', 18, 165124.8, 1082484.8, 'RECREATED REFUNDED', 'WP-94197586', 'WP-85987017', 'credit', '2022-10-14 03:43:35'),
(271, 807, 91736, 0.1, 'No', 18, 0, 80.7, 'RECREDITS', 'WP-85987017', 'WP-58001564', 'credit', '2022-10-14 03:46:51'),
(272, 6501, 90929, 0.1, 'No', 18, 0, 650.1, 'RECREDITS', 'WP-85987017', 'WP-46601109', 'credit', '2022-10-14 03:47:26'),
(273, 2986, 84428, 0.1, 'No', 18, 0, 298.6, 'RECREDITS', 'WP-85987017', 'WP-93420386', 'credit', '2022-10-14 03:48:02'),
(274, 3627, 81442, 0.1, 'No', 18, 0, 362.70000000000005, 'RECREDITS', 'WP-85987017', 'WP-35884399', 'credit', '2022-10-14 03:48:35'),
(275, 9393, 64510, 10, 'No', 18, 0, 93930, 'RECREATED', 'WP-11689852', 'WP-23415522', 'credit', '2022-10-14 03:59:22'),
(276, 7293, 55117, 10, 'No', 18, 0, 72930, 'RECREATED', 'WP-11689852', 'WP-48076506', 'credit', '2022-10-14 04:00:37'),
(277, 4007, 47824, 10, 'No', 18, 0, 40070, 'RECREATED', 'WP-11689852', 'WP-63617842', 'credit', '2022-10-14 04:01:42'),
(278, 124, 43817, 10, 'No', 18, 0, 1240, 'RECREATED', 'WP-11689852', 'WP-20875742', 'credit', '2022-10-14 04:01:58'),
(279, 25000, 43693, 10, 'No', 18, 0, 250000, 'RECREATED', 'WP-11689852', 'WP-18087807', 'credit', '2022-10-14 04:03:06'),
(280, 5809, 18693, 10, 'No', 18, 0, 58090, 'RECREATED', 'WP-11689852', 'WP-78635075', 'credit', '2022-10-14 04:03:28'),
(281, 236, 54654, 0.1, 'No', 18, 0, 23.6, 'tax included', 'WP-57872383', 'WP-84330483', 'credit', '2022-10-14 04:12:49'),
(282, 10, NULL, NULL, 'No', NULL, NULL, NULL, NULL, 'WP-94197586', 'WP-85987017', 'debit', '2022-10-14 04:29:19'),
(283, 5, 11, 10, 'No', 18, 0, 50, 'trial', 'WP-94197586', 'WP-88613570', 'credit', '2022-10-14 04:29:37'),
(284, 7292, NULL, NULL, 'No', NULL, NULL, NULL, NULL, 'WP-11689852', 'WP-48076506', 'debit', '2022-10-14 04:36:49'),
(285, 9392, NULL, NULL, 'No', NULL, NULL, NULL, NULL, 'WP-11689852', 'WP-23415522', 'debit', '2022-10-14 04:37:12'),
(286, 4006, NULL, NULL, 'No', NULL, NULL, NULL, NULL, 'WP-11689852', 'WP-63617842', 'debit', '2022-10-14 04:37:23'),
(287, 123, NULL, NULL, 'No', NULL, NULL, NULL, NULL, 'WP-11689852', 'WP-20875742', 'debit', '2022-10-14 04:37:40'),
(288, 24998, NULL, NULL, 'No', NULL, NULL, NULL, NULL, 'WP-11689852', 'WP-18087807', 'debit', '2022-10-14 04:37:52'),
(289, 5808, NULL, NULL, 'No', NULL, NULL, NULL, NULL, 'WP-11689852', 'WP-78635075', 'debit', '2022-10-14 04:38:25'),
(290, 18742, NULL, NULL, 'No', NULL, NULL, NULL, NULL, 'WP-57872383', 'WP-60736254', 'debit', '2022-10-14 04:39:17'),
(291, 64501, NULL, NULL, 'No', NULL, NULL, NULL, NULL, 'WP-94197586', 'WP-11689852', 'debit', '2022-10-14 04:39:18'),
(292, 1824, NULL, NULL, 'No', NULL, NULL, NULL, NULL, 'WP-57872383', 'WP-84330483', 'debit', '2022-10-14 04:39:42'),
(293, 806, NULL, NULL, 'No', NULL, NULL, NULL, NULL, 'WP-85987017', 'WP-58001564', 'debit', '2022-10-14 04:39:43'),
(294, 3097, NULL, NULL, 'No', NULL, NULL, NULL, NULL, 'WP-57872383', 'WP-31584474', 'debit', '2022-10-14 04:39:59'),
(295, 6500, NULL, NULL, 'No', NULL, NULL, NULL, NULL, 'WP-85987017', 'WP-46601109', 'debit', '2022-10-14 04:40:11'),
(296, 4013, NULL, NULL, 'No', NULL, NULL, NULL, NULL, 'WP-57872383', 'WP-31114354', 'debit', '2022-10-14 04:40:21'),
(297, 2985, NULL, NULL, 'No', NULL, NULL, NULL, NULL, 'WP-85987017', 'WP-93420386', 'debit', '2022-10-14 04:40:41'),
(298, 29444, NULL, NULL, 'No', NULL, NULL, NULL, NULL, 'WP-57872383', 'WP-63419477', 'debit', '2022-10-14 04:40:45'),
(299, 3626, NULL, NULL, 'No', NULL, NULL, NULL, NULL, 'WP-85987017', 'WP-35884399', 'debit', '2022-10-14 04:41:33'),
(300, 7499, NULL, NULL, 'No', NULL, NULL, NULL, NULL, 'WP-57872383', 'WP-45126928', 'debit', '2022-10-14 04:41:39'),
(301, 10999, NULL, NULL, 'No', NULL, NULL, NULL, NULL, 'WP-57872383', 'WP-96632879', 'debit', '2022-10-14 04:42:04'),
(302, 130035, NULL, NULL, 'No', NULL, NULL, NULL, NULL, 'WP-94197586', 'WP-57872383', 'debit', '2022-10-14 04:43:52'),
(303, 91721, NULL, NULL, 'No', NULL, NULL, NULL, NULL, 'WP-94197586', 'WP-85987017', 'debit', '2022-10-14 04:44:08'),
(304, 48171, NULL, NULL, 'No', NULL, NULL, NULL, NULL, 'adm01', 'WP-90861426', 'debit', '2022-10-14 05:01:04'),
(305, 6501, 286263, 10, 'No', 18, 0, 65010, 'Refunded', 'WP-94197586', 'WP-39165084', 'credit', '2022-10-14 05:26:39'),
(306, 807, 279762, 10, 'No', 18, 0, 8070, 'Refunded', 'WP-94197586', 'WP-71156351', 'credit', '2022-10-14 05:26:58'),
(307, 3627, 278955, 10, 'No', 18, 0, 36270, 'Refunded', 'WP-94197586', 'WP-94508852', 'credit', '2022-10-14 05:27:12'),
(308, 2986, 275328, 10, 'No', 18, 0, 29860, 'Refunded', 'WP-94197586', 'WP-51558947', 'credit', '2022-10-14 05:27:30'),
(309, 7293, 272342, 10, 'No', 18, 0, 72930, 'Refunded', 'WP-94197586', 'WP-91790089', 'credit', '2022-10-14 05:27:54'),
(310, 124, 265049, 10, 'No', 18, 0, 1240, 'Refunded', 'WP-94197586', 'WP-89789232', 'credit', '2022-10-14 05:28:39'),
(311, 5809, 264925, 10, 'No', 18, 0, 58090, 'Refunded', 'WP-94197586', 'WP-95586863', 'credit', '2022-10-14 05:28:58'),
(312, 25000, 259116, 10, 'No', 18, 0, 250000, 'Refunded', 'WP-94197586', 'WP-42187898', 'credit', '2022-10-14 05:29:17'),
(313, 9393, 234116, 10, 'No', 18, 0, 93930, 'Refunded', 'WP-94197586', 'WP-70561606', 'credit', '2022-10-14 05:29:37'),
(314, 4007, 224723, 10, 'No', 18, 0, 40070, 'Refunded', 'WP-94197586', 'WP-51548927', 'credit', '2022-10-14 05:29:52'),
(315, 11000, 220716, 10, 'No', 18, 0, 110000, 'Refunded', 'WP-94197586', 'WP-55945170', 'credit', '2022-10-14 05:30:23'),
(316, 7500, 209716, 10, 'No', 18, 0, 75000, 'Refunded', 'WP-94197586', 'WP-31667173', 'credit', '2022-10-14 05:30:44'),
(317, 29445, 202216, 10, 'No', 18, 0, 294450, 'Refunded', 'WP-94197586', 'WP-17951893', 'credit', '2022-10-14 05:31:14'),
(318, 4014, 172771, 10, 'No', 18, 0, 40140, 'Refunded', 'WP-94197586', 'WP-11239089', 'credit', '2022-10-14 05:31:34'),
(319, 3098, 168757, 10, 'No', 18, 0, 30980, 'Refunded', 'WP-94197586', 'WP-19079372', 'credit', '2022-10-14 05:31:56'),
(320, 1825, 165659, 10, 'No', 18, 0, 18250, 'Refunded', 'WP-94197586', 'WP-23095517', 'credit', '2022-10-14 05:32:14'),
(321, 18743, 163834, 10, 'No', 18, 0, 187430, 'Refunded', 'WP-94197586', 'WP-60400122', 'credit', '2022-10-14 05:32:55'),
(322, 95, 145091, 10, 'No', 18, 0, 950, 'Refunding fail to Non-whatsapp numbers.', 'WP-94197586', 'WP-19079372', 'credit', '2022-10-15 11:51:06'),
(323, 250, 144996, 10, 'No', 18, 0, 2500, 'Refunding fail to Non-whatsapp numbers.', 'WP-94197586', 'WP-23095517', 'credit', '2022-10-15 11:55:33'),
(324, 248, 144746, 10, 'No', 18, 0, 2480, 'Refunding failed to Non-whatsapp numbers.', 'WP-94197586', 'WP-23095517', 'credit', '2022-10-15 11:56:11'),
(325, 166, 144498, 10, 'No', 18, 0, 1660, 'Refunding for failed to Non-Whatsapp numbers', 'WP-94197586', 'WP-11239089', 'credit', '2022-10-15 03:54:04'),
(326, 18, 144332, 10, 'No', 18, 0, 180, 'Refunding for failed to send messages Non-whatsapp numbers', 'WP-94197586', 'WP-70561606', 'credit', '2022-10-17 12:32:48'),
(327, 112, 144314, 10, 'No', 18, 0, 1120, 'Refunding for failed messages to Non-whatsapp numbers.', 'WP-94197586', 'WP-19079372', 'credit', '2022-10-18 10:02:20'),
(328, 138, 144202, 10, 'No', 18, 0, 1380, 'Refunding for failed messages to Non-Whatsapp numbers', 'WP-94197586', 'WP-11239089', 'credit', '2022-10-18 10:03:57'),
(329, 4, 144064, 10, 'No', 18, 0, 40, 'R', 'WP-94197586', 'WP-94508852', 'credit', '2022-10-18 11:26:13'),
(330, 4, 144060, 10, 'No', 18, 0, 40, 'Refunding for failed to send Non-Whatsapp numbers.', 'WP-94197586', 'WP-94508852', 'credit', '2022-10-18 11:27:06'),
(331, 4, NULL, NULL, 'No', NULL, NULL, NULL, NULL, 'WP-94197586', 'WP-94508852', 'debit', '2022-10-18 11:28:43'),
(332, 198, 144060, 10, 'No', 18, 0, 1980, 'Refunding for failed to send messages Non-whatsapp numbers', 'WP-94197586', 'WP-95586863', 'credit', '2022-10-18 12:47:38'),
(333, 3, 143862, 10, 'No', 18, 0, 30, 'Refunding for failed to send messages to Non-Whatsapp numbers.', 'WP-94197586', 'WP-51558947', 'credit', '2022-10-18 03:00:46'),
(334, 17, 143859, 10, 'No', 18, 0, 170, 'Refunding for failed to send messages to Non-Whatsapp numbers.', 'WP-94197586', 'WP-70561606', 'credit', '2022-10-18 03:01:12'),
(335, 145, 143842, 10, 'No', 18, 0, 1450, 'Refunding for failed messages to Non-whatsapp numbers.', 'WP-94197586', 'WP-17951893', 'credit', '2022-10-18 04:12:57'),
(336, 250, 143697, 10, 'No', 18, 0, 2500, 'Refunding for failed messages to Non-Whatsapp numbers.', 'WP-94197586', 'WP-23095517', 'credit', '2022-10-19 10:39:20'),
(337, 166, 143447, 10, 'No', 18, 0, 1660, 'Refunding for failed messages to send Non-Whatsapp numbers', 'WP-94197586', 'WP-95586863', 'credit', '2022-10-19 11:44:37'),
(338, 12, 143281, 10, 'No', 18, 0, 120, 'Refunding for failed messages send to Non-Whatsapp numbers.', 'WP-94197586', 'WP-70561606', 'credit', '2022-10-19 02:16:25'),
(339, 150, 143269, 10, 'No', 18, 0, 1500, 'Refunding for failed messages send to Non-Whatsapp numbers.', 'WP-94197586', 'WP-11239089', 'credit', '2022-10-19 02:16:47'),
(340, 5, 143119, 10, 'No', 18, 0, 50, 'Refunding for failed to send Non-Whatsapp numbers', 'WP-94197586', 'WP-94508852', 'credit', '2022-10-19 02:44:45'),
(341, 114, 143114, 10, 'No', 18, 0, 1140, 'Refunding failed messages due to send Non-whatsapp numbers', 'WP-94197586', 'WP-19079372', 'credit', '2022-10-19 03:02:53'),
(342, 135, 143000, 10, 'No', 18, 0, 1350, 'Refunding for failed to send messages to Non-Whatsapp number.', 'WP-94197586', 'WP-17951893', 'credit', '2022-10-19 04:02:18'),
(343, 17, 142865, 10, 'No', 18, 0, 170, 'Refunding for failed to send Non-Whatsapp numbers', 'WP-94197586', 'WP-70561606', 'credit', '2022-10-20 09:35:50'),
(344, 13, 142848, 10, 'No', 18, 0, 130, 'Refunding for failed to send Non-Whatsapp numbers', 'WP-94197586', 'WP-70561606', 'credit', '2022-10-20 09:36:06'),
(345, 215, 142835, 10, 'No', 18, 0, 2150, 'Refunding due to request given mistakenly.', 'WP-94197586', 'WP-70561606', 'credit', '2022-10-20 10:53:29'),
(346, 251, 142620, 10, 'No', 18, 0, 2510, 'Refunding due to request given mistakenly.', 'WP-94197586', 'WP-70561606', 'credit', '2022-10-20 10:53:45'),
(347, 241, 142369, 10, 'No', 18, 0, 2410, 'Refunding due to request given mistakenly.', 'WP-94197586', 'WP-70561606', 'credit', '2022-10-20 10:53:59'),
(348, 205, 142128, 10, 'No', 18, 0, 2050, 'Refunding due to request given mistakenly.', 'WP-94197586', 'WP-70561606', 'credit', '2022-10-20 10:54:19'),
(349, 26, 141923, 10, 'No', 18, 0, 260, 'Refunding for failed to send Non-Whatsapp numbers', 'WP-94197586', 'WP-70561606', 'credit', '2022-10-20 12:49:12'),
(350, 2, 141897, 10, 'No', 18, 0, 20, 'Refunding for failed to send Non-Whatsapp numbers', 'WP-94197586', 'WP-31667173', 'credit', '2022-10-20 12:49:54'),
(351, 2, 141895, 10, 'No', 18, 0, 20, 'Refunding for failed to send Non-Whatsapp numbers', 'WP-94197586', 'WP-51558947', 'credit', '2022-10-20 05:06:41'),
(352, 10000, 141893, 10, 'No', 18, 0, 100000, 'New Customer', 'WP-94197586', 'WP-91161519', 'credit', '2022-10-21 11:59:55'),
(353, 96, 131893, 10, 'No', 18, 0, 960, 'Refunding for failed to send messages to Non-Whatsapp numbers.', 'WP-94197586', 'WP-19079372', 'credit', '2022-10-21 12:06:16'),
(354, 3, 131797, 10, 'No', 18, 0, 30, 'Refunding for failed to send Non-Whatsapp numbers.', 'WP-94197586', 'WP-51558947', 'credit', '2022-10-22 11:26:35'),
(355, 154, 131794, 10, 'No', 18, 0, 1540, 'Refunding for failed to send Non-Whatsapp numbers.', 'WP-94197586', 'WP-17951893', 'credit', '2022-10-22 11:27:07'),
(356, 187, 131640, 10, 'No', 18, 0, 1870, 'Refunding for failed to send Non-Whatsapp numbers.', 'WP-94197586', 'WP-11239089', 'credit', '2022-10-22 11:27:35'),
(357, 158, 131453, 10, 'No', 18, 0, 1580, 'Refunding for failed to send Non-Whatsapp numbers', 'WP-94197586', 'WP-95586863', 'credit', '2022-10-22 12:07:56'),
(358, 183, 131295, 10, 'No', 18, 0, 1830, 'Refunding for failed to send Non-Whatsapp number.', 'WP-94197586', 'WP-23095517', 'credit', '2022-10-22 02:23:12'),
(359, 111, 131112, 10, 'No', 18, 0, 1110, 'Refunding for failed to send Non-Whatsapp number.', 'WP-94197586', 'WP-19079372', 'credit', '2022-10-22 02:23:34'),
(360, 1, 131001, 10, 'No', 18, 0, 10, 'Refunding for failed to send Non Whatsapp numbers', 'WP-94197586', 'WP-31667173', 'credit', '2022-10-22 02:49:24'),
(361, 13, 131000, 10, 'No', 18, 0, 130, 'Refunding for failed to send Non-Whatsapp numbers', 'WP-94197586', 'WP-70561606', 'credit', '2022-10-22 03:33:45'),
(362, 4, 130987, 10, 'No', 18, 0, 40, 'Refunding for failed to send Non-Whatsapp number', 'WP-94197586', 'WP-70561606', 'credit', '2022-10-22 05:25:27'),
(363, 2, 130983, 10, 'No', 18, 0, 20, 'Refunding foe failed to send Non-Whatsapp numbers', 'WP-94197586', 'WP-51558947', 'credit', '2022-10-26 11:27:18'),
(364, 162, 130981, 10, 'No', 18, 0, 1620, 'Refunding for failed to send Non-Whatsapp numbers', 'WP-94197586', 'WP-17951893', 'credit', '2022-10-26 12:57:59'),
(365, 91, 130819, 10, 'No', 18, 0, 910, 'Refunding for failed to send Non-Whatsapp numbers', 'WP-94197586', 'WP-95586863', 'credit', '2022-10-26 02:25:42'),
(366, 200, 130728, 10, 'No', 18, 0, 2000, 'Refunding for failed to send Non-Whatsapp numbers', 'WP-94197586', 'WP-23095517', 'credit', '2022-10-26 02:39:35'),
(367, 175, 130528, 10, 'No', 18, 0, 1750, 'Refunding for failed to send Non-Whatsapp numbers', 'WP-94197586', 'WP-11239089', 'credit', '2022-10-26 04:59:46'),
(368, 56, 130353, 10, 'No', 18, 0, 560, 'Refunding for failed to send Non-Whatsapp numbers', 'WP-94197586', 'WP-94508852', 'credit', '2022-10-26 05:00:45'),
(369, 10000, 130297, 10, 'No', 18, 0, 100000, 'New Customer', 'WP-94197586', 'WP-67593610', 'credit', '2022-10-27 10:13:34'),
(370, 56, 120297, 10, 'No', 18, 0, 560, 'Refunding for failed to send Non-Whatsapp numbers	', 'WP-94197586', 'WP-19079372', 'credit', '2022-10-27 11:32:37'),
(371, 5, 120241, 10, 'No', 18, 0, 50, 'Refunding for failed to send Non-Whatsapp numbers', 'WP-94197586', 'WP-94508852', 'credit', '2022-10-27 02:00:55'),
(372, 152, 120236, 10, 'No', 18, 0, 1520, 'Refunding for failed to send Non-Whatsapp numbers', 'WP-94197586', 'WP-17951893', 'credit', '2022-10-27 02:01:13'),
(373, 87, 120084, 10, 'No', 18, 0, 870, 'Refunding for failed to send Non-Whatsapp numbers', 'WP-94197586', 'WP-23095517', 'credit', '2022-10-27 02:01:37'),
(374, 10000, 119997, 10, 'No', 18, 0, 100000, 'New Customer', 'WP-94197586', 'WP-70553622', 'credit', '2022-10-27 03:46:47'),
(375, 137, 109997, 10, 'No', 18, 0, 1370, 'Refunding for failed to send Non-Whatsapp numbers', 'WP-94197586', 'WP-11239089', 'credit', '2022-10-27 03:54:34'),
(376, 4, 109860, 10, 'No', 18, 0, 40, 'Refunding for failed to send Non-Whatsapp numbers', 'WP-94197586', 'WP-31667173', 'credit', '2022-10-27 03:54:54'),
(377, 101, 109856, 10, 'No', 18, 0, 1010, 'Refunding for failed to send Non-Whatsapp numbers', 'WP-94197586', 'WP-51548927', 'credit', '2022-10-27 03:55:43'),
(378, 45, 109755, 10, 'No', 18, 0, 450, 'Refunding for failed to send Non-Whatsapp numbers', 'WP-94197586', 'WP-94508852', 'credit', '2022-10-27 03:56:09'),
(379, 3, 109710, 10, 'No', 18, 0, 30, 'Refunding for failed to send Non-Whatsapp numbers', 'WP-94197586', 'WP-31667173', 'credit', '2022-10-27 04:26:10'),
(380, 43, 109707, 10, 'No', 18, 0, 430, 'Refunding for failed to send Non-Whatsapp numbers', 'WP-94197586', 'WP-67593610', 'credit', '2022-10-27 04:26:37'),
(381, 5, 109664, 10, 'No', 18, 0, 50, 'Refunding for failed to send Non-Whatsapp numbers', 'WP-94197586', 'WP-31667173', 'credit', '2022-10-27 04:59:26'),
(382, 2, 109659, 10, 'No', 18, 0, 20, 'Refunding for failed to send Non-Whatsapp numbers', 'WP-94197586', 'WP-51558947', 'credit', '2022-10-27 05:13:42'),
(383, 77, 109657, 10, 'No', 18, 0, 770, 'Refunding for failed to send Non-Whatsapp numbers', 'WP-94197586', 'WP-17951893', 'credit', '2022-10-28 12:25:45'),
(384, 84, 109580, 10, 'No', 18, 0, 840, 'Refunding for failed to send Non-Whatsapp numbers', 'WP-94197586', 'WP-19079372', 'credit', '2022-10-28 12:26:12'),
(385, 147, 109496, 10, 'No', 18, 0, 1470, 'Refunding for failed to send Non-Whatsapp numbers', 'WP-94197586', 'WP-11239089', 'credit', '2022-10-28 12:26:41');
INSERT INTO `transaction_logs` (`id`, `credit`, `old_credit`, `per_sms_price`, `tax_status`, `tax_percentage`, `tax_amount`, `total_amount`, `description`, `login_user_unique_id`, `user_unique_id`, `txn_type`, `created_at`) VALUES
(386, 42, 109349, 10, 'No', 18, 0, 420, 'Refunding for failed to send Non-Whatsapp numbers', 'WP-94197586', 'WP-67593610', 'credit', '2022-10-28 01:09:24'),
(387, 250, 109307, 10, 'No', 18, 0, 2500, 'Refunding due to request given mistakenly', 'WP-94197586', 'WP-67593610', 'credit', '2022-10-29 09:44:36'),
(388, 1, 109057, 10, 'No', 18, 0, 10, 'Refunding for failed to send Non-Whatsapp numbers	', 'WP-94197586', 'WP-31667173', 'credit', '2022-10-29 12:54:43'),
(389, 64, 109056, 10, 'No', 18, 0, 640, 'Refunding for failed to send Non-Whatsapp numbers	', 'WP-94197586', 'WP-67593610', 'credit', '2022-10-29 12:54:58'),
(390, 54, 108992, 10, 'No', 18, 0, 540, 'Refunding for failed to send Non-Whatsapp numbers	', 'WP-94197586', 'WP-67593610', 'credit', '2022-10-29 12:55:11'),
(391, 99, 108938, 10, 'No', 18, 0, 990, 'Refunding for failed to send Non-Whatsapp numbers	', 'WP-94197586', 'WP-17951893', 'credit', '2022-10-29 12:56:13'),
(392, 52, 108839, 10, 'No', 18, 0, 520, 'Refunding for failed to send Non-Whatsapp numbers	', 'WP-94197586', 'WP-94508852', 'credit', '2022-10-29 12:56:30'),
(393, 76, 108787, 10, 'No', 18, 0, 760, 'Refunding for failed to send messages to Non-Whatsapp numbers.', 'WP-94197586', 'WP-19079372', 'credit', '2022-10-29 04:17:04'),
(394, 2, 108711, 10, 'No', 18, 0, 20, 'Refunding for failed to send messages to Non-Whatsapp numbers.', 'WP-94197586', 'WP-51558947', 'credit', '2022-10-29 04:17:22'),
(395, 88, 108709, 10, 'No', 18, 0, 880, 'Refunding for failed to send messages to Non-Whatsapp numbers.', 'WP-94197586', 'WP-51548927', 'credit', '2022-10-29 04:18:14'),
(396, 1000, 108621, 10, 'No', 18, 0, 10000, 'New Customer', 'WP-94197586', 'WP-28223990', 'credit', '2022-10-30 12:40:31'),
(397, 10000, 107621, 10, 'No', 18, 0, 100000, 'New Customer', 'WP-94197586', 'WP-99058512', 'credit', '2022-10-30 01:17:01'),
(398, 47, 97621, 10, 'No', 18, 0, 470, 'Refunding for failed to send messages to Non-Whatsapp numbers.', 'WP-94197586', 'WP-11239089', 'credit', '2022-10-30 04:22:50'),
(399, 57, 97574, 10, 'No', 18, 0, 570, 'Refunding for failed to send messages to Non-Whatsapp numbers.', 'WP-94197586', 'WP-67593610', 'credit', '2022-10-30 04:23:04'),
(400, 83, 97517, 10, 'No', 18, 0, 830, 'Refunding for failed to send messages to Non-Whatsapp numbers.', 'WP-94197586', 'WP-19079372', 'credit', '2022-10-30 04:23:19'),
(401, 45, 97434, 10, 'No', 18, 0, 450, 'Refunding for failed to send messages to Non-Whatsapp numbers.', 'WP-94197586', 'WP-94508852', 'credit', '2022-10-30 04:23:34'),
(402, 2, 97389, 10, 'No', 18, 0, 20, 'Refunding for failed to send messages to Non-Whatsapp numbers.', 'WP-94197586', 'WP-51558947', 'credit', '2022-10-30 04:23:55'),
(403, 85, 97387, 10, 'No', 18, 0, 850, 'Refunding for failed to send messages to Non-Whatsapp numbers.', 'WP-94197586', 'WP-51548927', 'credit', '2022-10-30 05:02:57'),
(404, 52, 97302, 10, 'No', 18, 0, 520, 'Refunding for failed to send messages to Non-Whatsapp numbers.', 'WP-94197586', 'WP-67593610', 'credit', '2022-10-30 05:03:13'),
(405, 57, 97250, 10, 'No', 18, 0, 570, 'Refunding for failed to send messages to Non-Whatsapp numbers.', 'WP-94197586', 'WP-67593610', 'credit', '2022-10-30 05:23:22'),
(406, 6000, 97193, 10, 'No', 18, 0, 60000, 'New Customer', 'WP-94197586', 'WP-78954120', 'credit', '2022-10-31 11:30:30'),
(407, 86, 91193, 10, 'No', 18, 0, 860, 'Refunding for failed to send messages to Non-Whatsapp numbers.', 'WP-94197586', 'WP-19079372', 'credit', '2022-10-31 12:00:56'),
(408, 47, 91107, 10, 'No', 18, 0, 470, 'Refunding for failed to send messages to Non-Whatsapp numbers.', 'WP-94197586', 'WP-19079372', 'credit', '2022-10-31 12:01:12'),
(409, 44, 91060, 10, 'No', 18, 0, 440, 'Refunding for failed to send messages to Non-Whatsapp numbers.', 'WP-94197586', 'WP-11239089', 'credit', '2022-10-31 12:01:41'),
(410, 58, 91016, 10, 'No', 18, 0, 580, 'Refunding for failed to send messages to Non-Whatsapp numbers.', 'WP-94197586', 'WP-11239089', 'credit', '2022-10-31 12:01:54'),
(411, 56, 90958, 10, 'No', 18, 0, 560, 'Refunding for failed to send messages to Non-Whatsapp numbers.', 'WP-94197586', 'WP-11239089', 'credit', '2022-10-31 12:02:11'),
(412, 10000, 90902, 10, 'No', 18, 0, 100000, 'New Customer', 'WP-94197586', 'WP-98680131', 'credit', '2022-10-31 04:17:12'),
(413, 10000, 80902, 10, 'No', 18, 0, 100000, 'New Customer', 'WP-94197586', 'WP-73391125', 'credit', '2022-10-31 04:21:10'),
(414, 65, 70902, 10, 'No', 18, 0, 650, 'Refunding for failed to send messages to Non-Whatsapp numbers.', 'WP-94197586', 'WP-19079372', 'credit', '2022-10-31 05:00:18'),
(415, 57, 70837, 10, 'No', 18, 0, 570, 'Refunding for failed to send messages to Non-Whatsapp numbers.', 'WP-94197586', 'WP-94508852', 'credit', '2022-10-31 05:00:41'),
(416, 94, 70780, 10, 'No', 18, 0, 940, 'Refunding for failed to send messages to Non-Whatsapp numbers.', 'WP-94197586', 'WP-17951893', 'credit', '2022-10-31 05:01:03'),
(417, 2, 70686, 10, 'No', 18, 0, 20, 'Refunding for failed to send messages to Non-Whatsapp numbers.', 'WP-94197586', 'WP-51558947', 'credit', '2022-10-31 05:01:43'),
(418, 2, 70684, 10, 'No', 18, 0, 20, 'Refunding for failed to send messages to Non-Whatsapp numbers.', 'WP-94197586', 'WP-91161519', 'credit', '2022-10-31 05:02:03'),
(419, 58, 70682, 10, 'No', 18, 0, 580, 'Refunding for failed to send messages to Non-Whatsapp numbers.', 'WP-94197586', 'WP-11239089', 'credit', '2022-10-31 05:02:27'),
(420, 44, 70624, 10, 'No', 18, 0, 440, 'Refunding for failed to send messages to Non-Whatsapp numbers.', 'WP-94197586', 'WP-94508852', 'credit', '2022-10-31 05:03:11'),
(421, 6000, 70580, 10, 'No', 18, 0, 60000, 'New Customer', 'WP-94197586', 'WP-71524132', 'credit', '2022-11-01 12:13:16'),
(422, 16, 64580, 10, 'No', 18, 0, 160, 'Refunding for failed to send messages to Non-Whatsapp numbers.', 'WP-94197586', 'WP-70561606', 'credit', '2022-11-01 04:43:08'),
(423, 9, 64564, 10, 'No', 18, 0, 90, 'Refunding for failed to send messages to Non-Whatsapp numbers.', 'WP-94197586', 'WP-70561606', 'credit', '2022-11-01 04:43:31'),
(424, 67, 64555, 10, 'No', 18, 0, 670, 'Refunding for failed to send messages to Non-Whatsapp numbers.', 'WP-94197586', 'WP-17951893', 'credit', '2022-11-01 04:43:58'),
(425, 112, 64488, 10, 'No', 18, 0, 1120, 'Refunding for failed to send messages to Non-Whatsapp numbers.', 'WP-94197586', 'WP-70553622', 'credit', '2022-11-01 04:44:15'),
(426, 43, 64376, 10, 'No', 18, 0, 430, 'Refunding for failed to send messages to Non-Whatsapp numbers.', 'WP-94197586', 'WP-51548927', 'credit', '2022-11-01 04:44:41'),
(427, 159, 64333, 10, 'No', 18, 0, 1590, 'Refunding for failed to send messages to Non-Whatsapp numbers.', 'WP-94197586', 'WP-78954120', 'credit', '2022-11-01 04:45:05'),
(428, 1, 64174, 10, 'No', 18, 0, 10, 'Refunding for failed to send messages to Non-Whatsapp numbers.', 'WP-94197586', 'WP-91161519', 'credit', '2022-11-01 04:45:24'),
(429, 1, 64173, 10, 'No', 18, 0, 10, 'Refunding for failed to send messages to Non-Whatsapp numbers.', 'WP-94197586', 'WP-91161519', 'credit', '2022-11-01 04:45:36'),
(430, 4, 64172, 10, 'No', 18, 0, 40, 'Refunding for failed to send messages to Non-Whatsapp numbers.', 'WP-94197586', 'WP-70553622', 'credit', '2022-11-01 04:45:52'),
(431, 1, 64168, 10, 'No', 18, 0, 10, 'Refunding for failed to send messages to Non-Whatsapp numbers.	', 'WP-94197586', 'WP-73391125', 'credit', '2022-11-01 05:16:26'),
(432, 11, 64167, 10, 'No', 18, 0, 110, 'Refunding for failed to send messages to Non-Whatsapp numbers.	', 'WP-94197586', 'WP-70561606', 'credit', '2022-11-01 05:16:58'),
(433, 6000, 64156, 10, 'No', 18, 0, 60000, 'New Customer', 'WP-94197586', 'WP-52046036', 'credit', '2022-11-02 11:57:36'),
(434, 14, 58156, 10, 'No', 18, 0, 140, 'Refunding for failed to send messages to Non-Whatsapp numbers.', 'WP-94197586', 'WP-70561606', 'credit', '2022-11-02 12:16:32'),
(435, 13, 58142, 10, 'No', 18, 0, 130, 'Refunding for failed to send messages to Non-Whatsapp numbers.', 'WP-94197586', 'WP-70561606', 'credit', '2022-11-02 12:16:47'),
(436, 22, 58129, 10, 'No', 18, 0, 220, 'Refunding for failed to send messages to Non-Whatsapp numbers.', 'WP-94197586', 'WP-70561606', 'credit', '2022-11-02 05:15:22'),
(437, 6000, 58107, 10, 'No', 18, 0, 60000, 'New Customer', 'WP-94197586', 'WP-20091534', 'credit', '2022-11-03 10:21:14'),
(438, 201, 52107, 10, 'No', 18, 0, 2010, 'Mistakenly submitted request.', 'WP-94197586', 'WP-20091534', 'credit', '2022-11-03 11:43:52'),
(439, 177, 51906, 10, 'No', 18, 0, 1770, 'Mistakenly submitted Request', 'WP-94197586', 'WP-70553622', 'credit', '2022-11-03 02:27:41'),
(440, 6000, 51729, 10, 'No', 18, 0, 60000, 'Renewal', 'WP-94197586', 'WP-19079372', 'credit', '2022-11-03 05:02:43'),
(441, 13, 45729, 10, 'No', 18, 0, 130, 'Refunding for failed to send messages to Non-Whatsapp numbers.', 'WP-94197586', 'WP-70561606', 'credit', '2022-11-03 05:08:29'),
(442, 13, 45716, 10, 'No', 18, 0, 130, 'Refunding for failed to send messages to Non-Whatsapp numbers.', 'WP-94197586', 'WP-70561606', 'credit', '2022-11-03 05:08:44'),
(443, 11, 45703, 10, 'No', 18, 0, 110, 'Refunding for failed to send messages to Non-Whatsapp numbers.', 'WP-94197586', 'WP-70561606', 'credit', '2022-11-03 05:09:04'),
(444, 10, 45692, 10, 'No', 18, 0, 100, 'Refunding for failed to send messages to Non-Whatsapp numbers.', 'WP-94197586', 'WP-70561606', 'credit', '2022-11-03 05:09:17'),
(445, 52, 45682, 10, 'No', 18, 0, 520, 'Refunding for failed to send messages to Non-Whatsapp numbers.', 'WP-94197586', 'WP-52046036', 'credit', '2022-11-03 05:09:44'),
(446, 110, 45630, 10, 'No', 18, 0, 1100, 'Refunding for failed to send messages to Non-Whatsapp numbers.', 'WP-94197586', 'WP-99058512', 'credit', '2022-11-03 05:10:04'),
(447, 197, 45520, 10, 'No', 18, 0, 1970, 'Refunding for failed to send messages to Non-Whatsapp numbers.', 'WP-94197586', 'WP-78954120', 'credit', '2022-11-03 05:10:27'),
(448, 142, 45323, 10, 'No', 18, 0, 1420, 'Refunding for failed to send messages to Non-Whatsapp numbers.', 'WP-94197586', 'WP-70553622', 'credit', '2022-11-03 05:10:46'),
(449, 127, 45181, 10, 'No', 18, 0, 1270, 'Refunding for failed to send messages to Non-Whatsapp numbers.', 'WP-94197586', 'WP-70553622', 'credit', '2022-11-03 05:11:13'),
(450, 155, 45054, 10, 'No', 18, 0, 1550, 'Refunding for failed to send messages to Non-Whatsapp numbers.', 'WP-94197586', 'WP-70553622', 'credit', '2022-11-03 05:11:29'),
(451, 99, 44899, 10, 'No', 18, 0, 990, 'Refunding for failed to send messages to Non-Whatsapp numbers.', 'WP-94197586', 'WP-70553622', 'credit', '2022-11-03 05:11:43'),
(452, 108, 44800, 10, 'No', 18, 0, 1080, 'Refunding for failed to send messages to Non-Whatsapp numbers.', 'WP-94197586', 'WP-70553622', 'credit', '2022-11-03 05:11:59'),
(453, 57, 44692, 10, 'No', 18, 0, 570, 'Refunding for failed to send messages to Non-Whatsapp numbers.', 'WP-94197586', 'WP-94508852', 'credit', '2022-11-03 05:12:21'),
(454, 6000, 44635, 10, 'No', 18, 0, 60000, 'New Customer', 'WP-94197586', 'WP-29313267', 'credit', '2022-11-03 05:14:07'),
(455, 6000, 38635, 10, 'No', 18, 0, 60000, 'New Customer', 'WP-94197586', 'WP-53573947', 'credit', '2022-11-04 01:55:19'),
(456, 61, 32635, 10, 'No', 18, 0, 610, 'Refunding for failed to send messages to Non-Whatsapp numbers.', 'WP-94197586', 'WP-17951893', 'credit', '2022-11-04 05:15:31'),
(457, 67, 32574, 10, 'No', 18, 0, 670, 'Refunding for failed to send messages to Non-Whatsapp numbers.', 'WP-94197586', 'WP-17951893', 'credit', '2022-11-04 05:15:47'),
(458, 18, 32507, 10, 'No', 18, 0, 180, 'Refunding for failed to send messages to Non-Whatsapp numbers.', 'WP-94197586', 'WP-20091534', 'credit', '2022-11-05 05:49:35'),
(459, 18, 32489, 10, 'No', 18, 0, 180, 'Refunding for failed to send messages to Non-Whatsapp numbers.', 'WP-94197586', 'WP-20091534', 'credit', '2022-11-05 05:49:41'),
(460, 17, 32471, 10, 'No', 18, 0, 170, 'Refunding for failed to send messages to Non-Whatsapp numbers.', 'WP-94197586', 'WP-70561606', 'credit', '2022-11-05 05:49:58'),
(461, 17, 32454, 10, 'No', 18, 0, 170, 'Refunding for failed to send messages to Non-Whatsapp numbers.', 'WP-94197586', 'WP-20091534', 'credit', '2022-11-05 05:50:09'),
(462, 12, 32437, 10, 'No', 18, 0, 120, 'Refunding for failed to send messages to Non-Whatsapp numbers.', 'WP-94197586', 'WP-70561606', 'credit', '2022-11-05 05:50:24'),
(463, 16, 32425, 10, 'No', 18, 0, 160, 'Refunding for failed to send messages to Non-Whatsapp numbers.', 'WP-94197586', 'WP-70561606', 'credit', '2022-11-05 05:50:37'),
(464, 13, 32409, 10, 'No', 18, 0, 130, 'Refunding for failed to send messages to Non-Whatsapp numbers.', 'WP-94197586', 'WP-70561606', 'credit', '2022-11-05 05:50:51'),
(465, 86, 32396, 10, 'No', 18, 0, 860, 'Refunding for failed to send messages to Non-Whatsapp numbers.', 'WP-94197586', 'WP-19079372', 'credit', '2022-11-05 05:51:14'),
(466, 53, 32310, 10, 'No', 18, 0, 530, 'Refunding for failed to send messages to Non-Whatsapp numbers.', 'WP-94197586', 'WP-51548927', 'credit', '2022-11-05 05:51:32'),
(467, 53, 32257, 10, 'No', 18, 0, 530, 'Refunding for failed to send messages to Non-Whatsapp numbers.', 'WP-94197586', 'WP-52046036', 'credit', '2022-11-05 05:53:32'),
(468, 100, 32204, 10, 'No', 18, 0, 1000, 'Refunding for failed to send messages to Non-Whatsapp numbers.', 'WP-94197586', 'WP-78954120', 'credit', '2022-11-05 05:54:06'),
(469, 104, 32104, 10, 'No', 18, 0, 1040, 'Refunding for failed to send messages to Non-Whatsapp numbers.', 'WP-94197586', 'WP-99058512', 'credit', '2022-11-05 05:54:24'),
(470, 61, 32000, 10, 'No', 18, 0, 610, 'Refunding for failed to send messages to Non-Whatsapp numbers.', 'WP-94197586', 'WP-67593610', 'credit', '2022-11-05 05:54:44'),
(471, 3, 31939, 10, 'No', 18, 0, 30, 'Refunding for failed to send messages to Non-Whatsapp numbers.', 'WP-94197586', 'WP-91161519', 'credit', '2022-11-05 05:55:00'),
(472, 113, 31936, 10, 'No', 18, 0, 1130, 'Refunding for failed to send messages to Non-Whatsapp numbers.', 'WP-94197586', 'WP-70553622', 'credit', '2022-11-05 05:55:19'),
(473, 62, 31823, 10, 'No', 18, 0, 620, 'Refunding for failed to send messages to Non-Whatsapp numbers.', 'WP-94197586', 'WP-11239089', 'credit', '2022-11-05 05:55:37'),
(474, 47, 31761, 10, 'No', 18, 0, 470, 'Refunding for failed to send messages to Non-Whatsapp numbers.', 'WP-94197586', 'WP-94508852', 'credit', '2022-11-05 05:55:51'),
(475, 24, 31714, 10, 'No', 18, 0, 240, 'Refunding for failed to send messages to Non-Whatsapp numbers.', 'WP-94197586', 'WP-20091534', 'credit', '2022-11-05 05:56:07'),
(476, 73, 31690, 10, 'No', 18, 0, 730, 'Refunding for failed to send messages to Non-Whatsapp numbers.', 'WP-94197586', 'WP-17951893', 'credit', '2022-11-05 05:56:22'),
(477, 20000, 31617, 0.1, 'No', 18, 0, 2000, 'date - 08.11.2022\r\ninvoice no - s/sl/22-23/166\r\nplan - wesend premium\r\ncredits - 20k\r\nvalidity - (08.11.2022-13.12.2022)\r\nPh no - +91 70949 51177\r\nmailid - praveengrj111@gmail.com', 'WP-94197586', 'WP-53128226', 'credit', '2022-11-08 11:54:21'),
(478, 12, 11617, 0.1, 'No', 18, 0, 1.2000000000000002, 'REFUNDING FAILED TO SEND WHATSAPP NUMBER', 'WP-94197586', 'WP-70561606', 'credit', '2022-11-09 10:41:03'),
(479, 11, 11605, 0.1, 'No', 18, 0, 1.1, 'REFUNDING TO FAILED NONE WHATSAPP NUMBERS', 'WP-94197586', 'WP-70561606', 'credit', '2022-11-09 10:41:41'),
(480, 17, 11594, 0.1, 'No', 18, 0, 1.7000000000000002, 'REFUNDINGT FAILED TO SEND NONE WHATSAPP NUMBERS', 'WP-94197586', 'WP-70561606', 'credit', '2022-11-09 10:42:23'),
(481, 11, 11577, 0.1, 'No', 18, 0, 1.1, 'REFUNDING TO SEND NONE WHATSAPP NUMBERS', 'WP-94197586', 'WP-70561606', 'credit', '2022-11-09 10:42:57'),
(482, 600, 11566, 0.1, 'No', 18, 0, 60, 'REFUNDING FAILED TO SEND NONE WHATSAPP NUMBERS\r\n', 'WP-94197586', 'WP-53128226', 'credit', '2022-11-09 10:43:30'),
(483, 30, 10966, 0.1, 'No', 18, 0, 3, 'REFUNDING FAILED TO NONE WHATSAPP NUMBERS', 'WP-94197586', 'WP-78954120', 'credit', '2022-11-09 10:45:17'),
(484, 32, 10936, 0.1, 'No', 18, 0, 3.2, 'REFUNDING FAILED TO SEND NONE WHATSAPP NUMBERS\r\n', 'WP-94197586', 'WP-29313267', 'credit', '2022-11-09 10:46:15'),
(485, 209, 10904, 0.1, 'No', 18, 0, 20.900000000000002, 'REFUNDING FAILED TO SEND NONE WHATSAPP NUMBERS ', 'WP-94197586', 'WP-17951893', 'credit', '2022-11-09 11:04:35'),
(486, 10000, 10695, 0.1, 'No', 18, 0, 1000, 'RENEWAL FIRST HALF 10 K REMAINING 10 K ', 'WP-94197586', 'WP-70561606', 'credit', '2022-11-09 11:05:07'),
(487, 116, 695, 0.1, 'No', 18, 0, 11.600000000000001, 'rtefunding failed to send none whatsapp numbers ', 'WP-94197586', 'WP-51548927', 'credit', '2022-11-09 11:18:53'),
(488, 35, 579, 0.1, 'No', 18, 0, 3.5, 'REFUNDING FAILED TO SEND NOPNE WHATSAPP NUMBERS ', 'WP-94197586', 'WP-70553622', 'credit', '2022-11-09 11:33:05'),
(489, 5000, 544, 10, 'No', 18, 0, 50000, '5000 CREDITS ADDED ON 09-11-2022', 'adm01', 'WP-94197586', 'credit', '2022-11-09 11:42:52'),
(490, 15000, 5544, 10, 'No', 18, 0, 150000, 'ADDED 15000 CREDITS ON 09-11-2022', 'adm01', 'WP-94197586', 'credit', '2022-11-09 12:52:23'),
(491, 6000, 20544, 0.1, 'No', 18, 0, 600, 'WESEND BASIC PLAN \r\n', 'WP-94197586', 'WP-16118552', 'credit', '2022-11-09 12:55:02'),
(492, 10000, 14544, 0.1, 'No', 18, 0, 1000, 'PAYMENT MADE SECOND HALF\r\n', 'WP-94197586', 'WP-70561606', 'credit', '2022-11-09 12:56:43'),
(493, 252, 4544, 0.1, 'No', 18, 0, 25.200000000000003, 'REFUNDING ACCIDENTLY GIVEN SUBMITTION', 'WP-94197586', 'WP-16118552', 'credit', '2022-11-09 01:42:59'),
(494, 65, 4292, 0.1, 'No', 18, 0, 6.5, 'REFUNDING FAILED TO SEND NONE WHATSAPP NUMBERS ', 'WP-94197586', 'WP-67593610', 'credit', '2022-11-09 02:42:40'),
(495, 73, 4227, 0.1, 'No', 18, 0, 7.300000000000001, 'REFUNDING FAILED TO SEND NONE WHATSAPP NUMBERS ', 'WP-94197586', 'WP-67593610', 'credit', '2022-11-09 02:43:12'),
(496, 58, 4154, 0.1, 'No', 18, 0, 5.800000000000001, 'REFUNDING FAILED TO SEND NONE WHATSAPP NUMBERS ', 'WP-94197586', 'WP-67593610', 'credit', '2022-11-09 03:31:22'),
(497, 56, 4096, 0.1, 'No', 18, 0, 5.6000000000000005, 'REFUNDING FAILED TO SEND NONE WHATSAPP NUMBERS ', 'WP-94197586', 'WP-67593610', 'credit', '2022-11-09 03:31:48'),
(498, 53, 4040, 0.1, 'No', 18, 0, 5.300000000000001, 'REFUNDING THE FAILED TO SEND THE MESSAGES\r\n', 'WP-94197586', 'WP-16118552', 'credit', '2022-11-09 04:44:23'),
(499, 251, 3987, 10, 'No', 18, 0, 2510, 'Refunding for failed to send messages to Non-Whatsapp numbers.', 'WP-94197586', 'WP-16118552', 'credit', '2022-11-10 10:47:21'),
(500, 251, NULL, NULL, 'No', NULL, NULL, NULL, NULL, 'WP-94197586', 'WP-16118552', 'debit', '2022-11-10 10:49:30'),
(501, 500, 3987, 10, 'No', 18, 0, 5000, 'Refunded as per customer request.', 'WP-94197586', 'WP-29313267', 'credit', '2022-11-10 10:51:09'),
(502, 12000, 0, 10, 'No', 18, 0, 120000, '12000 CREDITS ADDED ON 13-11-2022', 'adm01', 'WP-23811024', 'credit', '2022-11-13 01:00:13'),
(503, 6000, 0, 10, 'No', 18, 0, 60000, '6000 CREDITS ADDED ON 13-11-2022', 'adm01', 'WP-97265146', 'credit', '2022-11-13 05:38:24'),
(504, 3486, NULL, NULL, 'No', NULL, NULL, NULL, NULL, 'adm01', 'WP-94197586', 'debit', '2022-11-13 07:58:38'),
(505, 20, 14252, 10, 'No', 18, 0, 200, 'REFUND FOR UNIQUEID WP-95116109', 'adm01', 'WP-70561606', 'credit', '2022-11-15 04:07:19'),
(506, 208, 3610, 10, 'No', 18, 0, 2080, '208 CREDITS REFUND FOR UNIQUEID WP-57700443', 'adm01', 'WP-16118552', 'credit', '2022-11-15 04:10:52'),
(507, 257, 3818, 10, 'No', 18, 0, 2570, '257 CREDITS REFUND FOR UNIQUEID WP-25719500', 'adm01', 'WP-16118552', 'credit', '2022-11-15 04:12:06'),
(508, 7, 14272, 10, 'No', 18, 0, 70, '7 CREDITS REFUND FOR WP-67819474', 'adm01', 'WP-70561606', 'credit', '2022-11-15 07:58:37'),
(509, 110, 24587, 10, 'No', 18, 0, 1100, '110 CREDITS REFUND FOR UNIQUEID WP-57242402', 'adm01', 'WP-17951893', 'credit', '2022-11-16 10:43:03'),
(510, 4, 2236, 10, 'No', 18, 0, 40, 'REFUND FOR UNIQUEID WP-25094753', 'adm01', 'WP-71524132', 'credit', '2022-11-16 10:44:26'),
(511, 22, 5364, 10, 'No', 18, 0, 220, 'REFUND FOR WP-85145070', 'adm01', 'WP-20091534', 'credit', '2022-11-16 10:45:23'),
(512, 32, 0, 10, 'No', 18, 0, 320, 'REFUND FOR WP-64986765', 'adm01', 'WP-94508852', 'credit', '2022-11-16 10:46:18'),
(513, 254, 4693, 10, 'No', 18, 0, 2540, 'REFUND FOR WP-81757787', 'adm01', 'WP-29313267', 'credit', '2022-11-16 10:47:04'),
(514, 52, 4190, 10, 'No', 18, 0, 520, 'REFUND FOR WP-80298899', 'adm01', 'WP-78954120', 'credit', '2022-11-16 10:47:50'),
(515, 3, 6481, 10, 'No', 18, 0, 30, 'REFUND FOR WP-73962712', 'adm01', 'WP-73391125', 'credit', '2022-11-16 10:48:48'),
(516, 275, 17601, 10, 'No', 18, 0, 2750, 'REFUND FOR WP-19812819', 'adm01', 'WP-53128226', 'credit', '2022-11-16 10:49:35'),
(517, 2, 5044, 10, 'No', 18, 0, 20, 'REFUND FOR WP-80207281', 'adm01', 'WP-91161519', 'credit', '2022-11-16 10:52:05'),
(518, 67, 4387, 10, 'No', 18, 0, 670, 'REFUND FOR WP-28161280', 'adm01', 'WP-52046036', 'credit', '2022-11-16 10:52:41'),
(519, 124, 7370, 10, 'No', 18, 0, 1240, 'REFUND FOR WP-34736175', 'adm01', 'WP-99058512', 'credit', '2022-11-16 10:53:17'),
(520, 74, 24697, 10, 'No', 18, 0, 740, 'REFUND FOR WP-71219656', 'adm01', 'WP-17951893', 'credit', '2022-11-16 10:53:49'),
(521, 29, 2240, 10, 'No', 18, 0, 290, 'REFUND FOR WP-68155819', 'adm01', 'WP-71524132', 'credit', '2022-11-16 10:54:23'),
(522, 23, 5386, 10, 'No', 18, 0, 230, 'REFUND FOR WP-36036380', 'adm01', 'WP-20091534', 'credit', '2022-11-16 10:55:22'),
(523, 74, 4947, 10, 'No', 18, 0, 740, 'REFUND FOR WP-22420007', 'adm01', 'WP-29313267', 'credit', '2022-11-16 10:56:06'),
(524, 57, 4242, 10, 'No', 18, 0, 570, 'REFUND FOR WP-89934334', 'adm01', 'WP-78954120', 'credit', '2022-11-16 10:56:48'),
(525, 6000, 0, 10, 'No', 18, 0, 60000, '6000 CREDITS ADDED ON 16-11-2022 ONE MONTH VALIDITY', 'adm01', 'WP-65117802', 'credit', '2022-11-16 12:06:35'),
(526, 30, 14279, 10, 'No', 18, 0, 300, 'REFUND FOR WP-30998258', 'adm01', 'WP-70561606', 'credit', '2022-11-16 06:20:25'),
(527, 39, 17876, 10, 'No', 18, 0, 390, 'REFUND FOR WP-16716308', 'adm01', 'WP-53128226', 'credit', '2022-11-16 06:22:04'),
(528, 67, 4454, 10, 'No', 18, 0, 670, 'REFUND FOR WP-14409941', 'adm01', 'WP-52046036', 'credit', '2022-11-16 06:22:52'),
(529, 123, 7494, 10, 'No', 18, 0, 1230, 'REFUND FOR WP-91906030', 'adm01', 'WP-99058512', 'credit', '2022-11-16 06:23:36'),
(530, 32, 4075, 10, 'No', 18, 0, 320, 'REFUND FOR WP-31219250', 'adm01', 'WP-16118552', 'credit', '2022-11-16 06:24:19'),
(531, 23, 11398, 10, 'No', 18, 0, 230, 'REFUND FOR WP-74213686', 'adm01', 'WP-23811024', 'credit', '2022-11-16 06:25:26'),
(532, 55, 5400, 10, 'No', 18, 0, 550, 'REFUND FOR WP-93612876', 'adm01', 'WP-97265146', 'credit', '2022-11-16 06:27:18'),
(533, 14, 12309, 10, 'No', 18, 0, 140, 'REFUND FOR WP-71670108', 'adm01', 'WP-70561606', 'credit', '2022-11-18 01:19:11'),
(534, 48, 2698, 10, 'No', 18, 0, 480, 'REFUND FOR WP-49994148', 'adm01', 'WP-78954120', 'credit', '2022-11-18 01:19:49'),
(535, 3, 6229, 10, 'No', 18, 0, 30, 'REFUND FOR WP-77955676', 'adm01', 'WP-73391125', 'credit', '2022-11-18 01:20:31'),
(536, 87, 3400, 10, 'No', 18, 0, 870, 'REFUND FOR WP-94269327', 'adm01', 'WP-29313267', 'credit', '2022-11-18 01:21:18'),
(537, 50, 6817, 10, 'No', 18, 0, 500, 'REFUND FOR WP-91390146', 'adm01', 'WP-99058512', 'credit', '2022-11-18 01:22:01'),
(538, 49, 2485, 10, 'No', 18, 0, 490, 'REFUND FOR WP-72281557', 'adm01', 'WP-16118552', 'credit', '2022-11-18 01:22:36'),
(539, 145, 11421, 10, 'No', 18, 0, 1450, 'REFUND FOR WP-74503643', 'adm01', 'WP-23811024', 'credit', '2022-11-18 01:23:07'),
(540, 28, 12323, 10, 'No', 18, 0, 280, 'REFUND FOR WP-23149887,WP-19450056', 'adm01', 'WP-70561606', 'credit', '2022-11-18 01:24:05'),
(541, 6000, 32, 10, 'No', 18, 0, 60000, '6000 CREDITS ADDED ON 18-11-2022 FOR INVOICE-S/SL/22-23/196', 'adm01', 'WP-94508852', 'credit', '2022-11-18 02:53:27'),
(542, 41, 12351, 10, 'No', 18, 0, 410, 'REFUND FOR WP-31336828,WP-22027874', 'adm01', 'WP-70561606', 'credit', '2022-11-19 06:58:46'),
(543, 109, 3487, 10, 'No', 18, 0, 1090, 'REFUND FOR WP-17054321', 'adm01', 'WP-29313267', 'credit', '2022-11-19 06:59:46'),
(544, 6000, 0, 10, 'No', 18, 0, 60000, '6000 CREDITS ADDED ON 21-11-2022 INVOICE NO-S/SL/22-23/199', 'adm01', 'WP-85476944', 'credit', '2022-11-21 02:25:18'),
(545, 6000, 0, 10, 'No', 18, 0, 60000, '6000 CREDITS ON 21-11-2022 FOR INVOICE NO-S/SL/22-23/200', 'adm01', 'WP-43868200', 'credit', '2022-11-21 03:08:25'),
(546, 12000, 0, 10, 'No', 18, 0, 120000, '12000 CREDITS ADDED ON 23-11-2022 FOR INVOICENO-S/SL/22-23/205\r\n', 'adm01', 'WP-32108526', 'credit', '2022-11-23 12:42:36'),
(547, 7, 11430, 10, 'No', 18, 0, 70, 'REFUND FOR WP-53571165', 'adm01', 'WP-70561606', 'credit', '2022-11-25 08:12:49'),
(548, 56, 23165, 10, 'No', 18, 0, 560, 'REFUND FOR WP-55669920', 'adm01', 'WP-17951893', 'credit', '2022-11-25 08:13:25'),
(549, 49, 3918, 10, 'No', 18, 0, 490, 'REFUND FOR WP-63992906', 'adm01', 'WP-95586863', 'credit', '2022-11-25 08:14:11'),
(550, 1553, 2534, 10, 'No', 18, 0, 15530, 'REFUND FOR WP-27795790', 'adm01', 'WP-16118552', 'credit', '2022-11-25 08:14:51'),
(551, 12000, 0, 10, 'No', 18, 0, 120000, '12000 CREDITS ADDED ON 25-11-2022 FOR INVOICE NO- S/SL/22-23/208', 'adm01', 'WP-69149660', 'credit', '2022-11-25 08:18:32'),
(552, 72, 3000, 10, 'No', 18, 0, 720, 'REFUND FOR WP-55968784', 'adm01', 'WP-52046036', 'credit', '2022-11-25 10:10:47'),
(553, 81, 3596, 10, 'No', 18, 0, 810, 'REFUND FOR WP-39939009', 'adm01', 'WP-29313267', 'credit', '2022-11-25 10:11:24'),
(554, 111, 2746, 10, 'No', 18, 0, 1110, 'REFUND FOR WP-61826053', 'adm01', 'WP-78954120', 'credit', '2022-11-25 10:12:06'),
(555, 50, 3499, 10, 'No', 18, 0, 500, 'REFUND FOR WP-64102906', 'adm01', 'WP-99058512', 'credit', '2022-11-25 10:13:19'),
(556, 10, 11437, 10, 'No', 18, 0, 100, 'REFUNDFOR WP-15005378', 'adm01', 'WP-70561606', 'credit', '2022-11-25 10:14:03'),
(557, 40, 23221, 10, 'No', 18, 0, 400, 'REFUND FOR WP-86772986', 'adm01', 'WP-17951893', 'credit', '2022-11-25 10:15:07'),
(558, 4, 6232, 10, 'No', 18, 0, 40, 'REFUND FOR WP-17941397', 'adm01', 'WP-73391125', 'credit', '2022-11-25 10:15:51'),
(559, 30, 4554, 10, 'No', 18, 0, 300, 'REFUND FOR WP-78650232', 'adm01', 'WP-97265146', 'credit', '2022-11-25 10:16:58'),
(560, 61, 3072, 10, 'No', 18, 0, 610, 'REFUND FOR WP-19661244', 'adm01', 'WP-52046036', 'credit', '2022-11-27 05:29:43'),
(561, 101, 3677, 10, 'No', 18, 0, 1010, 'REFUND FOR WP-15756561', 'adm01', 'WP-29313267', 'credit', '2022-11-27 05:30:47'),
(562, 70, 2857, 10, 'No', 18, 0, 700, 'REFUND FOR WP-93974161', 'adm01', 'WP-78954120', 'credit', '2022-11-27 05:31:25'),
(563, 106, 3549, 10, 'No', 18, 0, 1060, 'REFUND FOR WP-78191901', 'adm01', 'WP-99058512', 'credit', '2022-11-27 05:32:05'),
(564, 95, 4799, 10, 'No', 18, 0, 950, 'REFUND FOR WP-12374765', 'adm01', 'WP-20091534', 'credit', '2022-11-27 05:32:39'),
(565, 14, 11447, 10, 'No', 18, 0, 140, 'REFUND FOR WP-87171502', 'adm01', 'WP-70561606', 'credit', '2022-11-27 05:33:18'),
(566, 55, 23261, 10, 'No', 18, 0, 550, 'REFUND FOR WP-53227644', 'adm01', 'WP-17951893', 'credit', '2022-11-27 05:33:52'),
(567, 8, 4267, 10, 'No', 18, 0, 80, 'REFUND FOR WP-43372844', 'adm01', 'WP-97265146', 'credit', '2022-11-27 05:34:34'),
(568, 32, 3488, 10, 'No', 18, 0, 320, 'REFUND FOR WP-29521817', 'adm01', 'WP-16118552', 'credit', '2022-11-27 05:35:06'),
(569, 67, 3133, 10, 'No', 18, 0, 670, 'REFUND FOR WP-11458525\r\n', 'adm01', 'WP-52046036', 'credit', '2022-11-28 06:06:59'),
(570, 62, 3778, 10, 'No', 18, 0, 620, 'REFUND FOR WP-43504937\r\n', 'adm01', 'WP-29313267', 'credit', '2022-11-28 06:07:38'),
(571, 77, 2927, 10, 'No', 18, 0, 770, 'REFUND FOR WP-51364520\r\n', 'adm01', 'WP-78954120', 'credit', '2022-11-28 06:08:24'),
(572, 11, 3655, 10, 'No', 18, 0, 110, 'REFUND FOR WP-89363949\r\n', 'adm01', 'WP-99058512', 'credit', '2022-11-28 06:09:01'),
(573, 1, 10244, 10, 'No', 18, 0, 10, 'REFUND FOR WP-32120824\r\n', 'adm01', 'WP-32108526', 'credit', '2022-11-28 06:09:39'),
(574, 10, 880, 10, 'No', 18, 0, 100, 'REFUND FOR WP-11782144\r\n', 'adm01', 'WP-65117802', 'credit', '2022-11-28 06:10:12'),
(575, 24, 9461, 10, 'No', 18, 0, 240, 'REFUND FOR WP-28123844\r\n', 'adm01', 'WP-70561606', 'credit', '2022-11-28 06:10:46'),
(576, 68, 4295, 10, 'No', 18, 0, 680, 'REFUND FOR WP-74219362\r\n', 'adm01', 'WP-85476944', 'credit', '2022-11-28 06:23:27'),
(577, 5, 26, 10, 'No', 18, 0, 50, 'REFUND FOR WP-72089692\r\n', 'adm01', 'WP-91161519', 'credit', '2022-11-28 06:24:00'),
(578, 31, 4275, 10, 'No', 18, 0, 310, 'REFUND FOR WP-WP-21690515\r\n', 'adm01', 'WP-97265146', 'credit', '2022-11-30 03:03:23'),
(579, 66, 2728, 10, 'No', 18, 0, 660, 'REFUND FOR WP-WP- 80513184\r\n', 'adm01', 'WP-16118552', 'credit', '2022-11-30 03:04:04'),
(580, 52, 3200, 10, 'No', 18, 0, 520, 'REFUD FOR WP-WP-89751832\r\n', 'adm01', 'WP-52046036', 'credit', '2022-11-30 03:10:24'),
(581, 32, 0, 10, 'No', 18, 0, 320, 'REFUND FOR WP-WP-20638056\r\n', 'adm01', 'WP-29313267', 'credit', '2022-11-30 03:11:04'),
(582, 100, 3004, 10, 'No', 18, 0, 1000, 'REFUND FOR WP-WP-27082491\r\n', 'adm01', 'WP-78954120', 'credit', '2022-11-30 03:11:44'),
(583, 84, 3666, 10, 'No', 18, 0, 840, 'REFUND FOR WP-WP-11398113\r\n', 'adm01', 'WP-99058512', 'credit', '2022-11-30 03:12:27'),
(584, 166, 10000, 10, 'No', 18, 0, 1660, 'REFUND FOR WP-WP-94257204\r\n', 'adm01', 'WP-69149660', 'credit', '2022-11-30 03:14:31'),
(585, 20, 9485, 10, 'No', 18, 0, 200, 'REFUND FOR WP-43304579', 'adm01', 'WP-70561606', 'credit', '2022-12-01 10:37:58'),
(586, 30, 2759, 10, 'No', 18, 0, 300, 'REFUND FOR WP-17167990', 'adm01', 'WP-85476944', 'credit', '2022-12-01 10:38:39'),
(587, 12000, 0, 10, 'No', 18, 0, 120000, '12000 CREDITS ADDED ON 05-12-2022 FOR INVOICE NO-S/SL/22-23/225', 'adm01', 'WP-66774894', 'credit', '2022-12-05 10:43:46'),
(588, 2, 0, 10, 'No', 18, 0, 20, 'REFUND FOR WP-83242302\r\n', 'adm01', 'WP-53573947', 'credit', '2022-12-06 09:45:51'),
(589, 24, 9505, 10, 'No', 18, 0, 240, 'REFUND FOR WP-23159734\r\n', 'adm01', 'WP-70561606', 'credit', '2022-12-06 09:46:27'),
(590, 21, 9529, 10, 'No', 18, 0, 210, 'REFUND FOR  WP-89595529\r\n', 'adm01', 'WP-70561606', 'credit', '2022-12-06 09:46:53'),
(591, 136, 10166, 10, 'No', 18, 0, 1360, 'REFUND FOR WP-42200911\r\n', 'adm01', 'WP-69149660', 'credit', '2022-12-06 09:47:23'),
(592, 3, 890, 10, 'No', 18, 0, 30, 'REFUND FOR WP--46979785\r\n', 'adm01', 'WP-65117802', 'credit', '2022-12-06 09:47:47'),
(593, 2, 0, 10, 'No', 18, 0, 20, 'REFUDN FOR WP-58297556\r\n', 'adm01', 'WP-71524132', 'credit', '2022-12-06 09:48:11'),
(594, 20, 9550, 10, 'No', 18, 0, 200, 'REFUND FOR WP--43974808\r\n', 'adm01', 'WP-70561606', 'credit', '2022-12-06 09:48:34'),
(595, 122, 0, 10, 'No', 18, 0, 1220, 'REFUND FOR wp-39923552\r\n', 'adm01', 'WP-99058512', 'credit', '2022-12-07 08:22:27'),
(596, 79, 1832, 10, 'No', 18, 0, 790, 'REFUND FOR WP-91813844\r\n', 'adm01', 'WP-16118552', 'credit', '2022-12-08 07:36:44'),
(597, 111, 4, 10, 'No', 18, 0, 1110, 'REFUND FOR  WP-21615677\r\n', 'adm01', 'WP-78954120', 'credit', '2022-12-08 07:37:25'),
(598, 20, 7570, 10, 'No', 18, 0, 200, 'REFUND FOR WP-30526580\r\n', 'adm01', 'WP-70561606', 'credit', '2022-12-08 07:38:00'),
(599, 54, 32, 10, 'No', 18, 0, 540, 'REFUND FOR WP-76684069', 'adm01', 'WP-29313267', 'credit', '2022-12-09 06:19:02'),
(600, 73, 734, 10, 'No', 18, 0, 730, 'REFUND FOR  WP-20704366\r\n', 'adm01', 'WP-16118552', 'credit', '2022-12-09 06:28:11'),
(601, 23, 7590, 10, 'No', 18, 0, 230, 'REFUND FOR WP-75261987\r\n', 'adm01', 'WP-70561606', 'credit', '2022-12-09 06:28:49'),
(602, 133, 23316, 10, 'No', 18, 0, 1330, 'REFUND FOR WP-60331437\r\n', 'adm01', 'WP-17951893', 'credit', '2022-12-09 06:29:28'),
(603, 108, 2, 10, 'No', 18, 0, 1080, 'REFUND FOR WP-96795105\r\n', 'adm01', 'WP-52046036', 'credit', '2022-12-13 09:24:21'),
(604, 106, 122, 10, 'No', 18, 0, 1060, 'REFUND FOR  WP-49154260\r\n', 'adm01', 'WP-99058512', 'credit', '2022-12-13 09:25:02'),
(605, 10000, 0, 10, 'No', 18, 0, 100000, '10K CREDITS ADDED ON 14-12-2022 FOR INVOICE NO-S/SL/22-23/239', 'adm01', 'WP-83883557', 'credit', '2022-12-14 03:11:18'),
(606, 107, 203, 10, 'No', 18, 0, 1070, 'REFUND FOR WP-WP-47571396\r\n', 'adm01', 'WP-16118552', 'credit', '2022-12-15 01:00:49'),
(607, 6000, 0, 10, 'No', 18, 0, 60000, 'CREDITS ADDED ON 15-12-2022 FOR INVOICE S/SL/22-23/241', 'adm01', 'WP-79182174', 'credit', '2022-12-15 03:21:15'),
(608, 150, 115, 10, 'No', 18, 0, 1500, 'REFUND FOR WP-WP-41597983\r\n', 'adm01', 'WP-78954120', 'credit', '2022-12-15 06:49:42'),
(609, 131, 2196, 10, 'No', 18, 0, 1310, 'REFUND FOR WP-46766186 ON 16-12-2022\r\n', 'adm01', 'WP-95586863', 'credit', '2022-12-16 07:44:01'),
(610, 99, 3090, 10, 'No', 18, 0, 990, 'REFUND FOR WP-90548414 ON 16-12-2022\r\n', 'adm01', 'WP-20091534', 'credit', '2022-12-16 07:44:44'),
(611, 20000, 0, 10, 'No', 18, 0, 200000, '20K CREDITS ADDED FOR INVOICE-S/SL/22-23/244 ON 17-12-2022', 'adm01', 'WP-92342183', 'credit', '2022-12-17 04:30:11'),
(612, 15, 7613, 10, 'No', 18, 0, 150, 'REFUND FOR WP-77414771 ON 17-12-2022\r\n', 'adm01', 'WP-70561606', 'credit', '2022-12-17 07:41:10'),
(613, 20000, 0, 10, 'No', 18, 0, 200000, '20K CREDITS ADDED FOR INVOICE S/SL/22-23/246 ON 18-12-2022', 'adm01', 'WP-73745417', 'credit', '2022-12-18 10:18:03'),
(614, 62489, 1, 10, 'No', 18, 0, 624890, 'REQUEST ID\'S FROM 17-11-2022 TO 16-12-2022 ARE DISCARDED AND RELATED CREDITS ARE ADDED (62489) ON 19-12-2022', 'adm01', 'WP-94197586', 'credit', '2022-12-19 12:18:08'),
(615, 4250, 62490, 0.1, 'No', 18, 0, 425, 'WP-70320437\r\nWP-74836755\r\nWP-92448028\r\nWP-22403636\r\nWP-37115932\r\nWP-60735811\r\nWP-89223910\r\nWP-72940712\r\nWP-14272789\r\nWP-61180982\r\nWP-71651440\r\nWP-87280919\r\nWP-91555014\r\nWP-78520339\r\nWP-39837600\r\nWP-82834913\r\nWP-71781702\r\n', 'WP-94197586', 'WP-91161519', 'credit', '2022-12-19 03:25:09'),
(616, 2750, 58240, 0.1, 'No', 18, 0, 275, 'PENDING  TASK-REFUND CREDITS\r\nWP-85334456\r\nWP-90377527\r\nWP-34847402\r\nWP-58703490\r\nWP-65881905\r\nWP-71905311\r\n', 'WP-94197586', 'WP-52046036', 'credit', '2022-12-19 03:40:51'),
(617, 1269, 55490, 0.1, 'No', 18, 0, 126.9, 'PENDING TASK- REFUND CREDITS\r\nWP-70429482\r\nWP-42797001\r\n', 'WP-94197586', 'WP-95586863', 'credit', '2022-12-19 03:46:00'),
(618, 3490, 54221, 0.1, 'No', 18, 0, 349, 'PENDING REQUEST-REFUND CREDITS\r\nWP-33627823\r\nWP-90783020\r\nWP-27894204\r\nWP-76035043\r\nWP-96885092\r\nWP-31545938\r\nWP-94833335\r\nWP-57002402\r\nWP-82191761\r\n', 'WP-94197586', 'WP-29313267', 'credit', '2022-12-20 10:35:00'),
(619, 800, 50731, 0.1, 'No', 18, 0, 80, 'PENDING REQUEST- REFUND CREDITS\r\nWP-45175943\r\nWP-79769565\r\nWP-61967648\r\n', 'WP-94197586', 'WP-83883557', 'credit', '2022-12-20 10:37:17'),
(620, 7050, 49931, 0.1, 'No', 18, 0, 705, 'PENDING EQUEST- RFUND CREDITS\r\nWP-83028819\r\nWP-43367034\r\nWP-39800196\r\nWP-96410178\r\nWP-26579228\r\nWP-70323381\r\nWP-95579566\r\nWP-66648750\r\nWP-41558274\r\nWP-18471853\r\nWP-20289962\r\nWP-66768510\r\nWP-64512352\r\nWP-38927068\r\nWP-28186025\r\n', 'WP-94197586', 'WP-99058512', 'credit', '2022-12-20 10:40:00'),
(621, 1100, 42881, 0.1, 'No', 18, 0, 110, 'PENDING REQUEST- REFUD CREDITS\r\nWP-34754637\r\nWP-28610872\r\nWP-73172785\r\nWP-75260862\r\n', 'WP-94197586', 'WP-17951893', 'credit', '2022-12-20 10:41:21'),
(622, 2750, 41781, 0.1, 'No', 18, 0, 275, 'PENDING REQUEST-REFUND CREDITS\r\nWP-37439747\r\nWP-28797180\r\nWP-90490580\r\nWP-67970034\r\nWP-56549436\r\nWP-27438862\r\n', 'WP-94197586', 'WP-32108526', 'credit', '2022-12-20 10:42:57'),
(623, 4400, 39031, 0.1, 'No', 18, 0, 440, 'PENDING REQUEST-REFUND CREDITS\r\nWP-58603232\r\nWP-54037740\r\nWP-54330753\r\nWP-34521249\r\nWP-30983146\r\nWP-86839373\r\nWP-38782523\r\nWP-69336464\r\nWP-72136763\r\nWP-51023436\r\n', 'WP-94197586', 'WP-97265146', 'credit', '2022-12-20 10:44:56'),
(624, 2251, 34631, 0.1, 'No', 18, 0, 225.10000000000002, 'PENDING  REQUEST- REFUND CREDITS\r\nWP-80739731\r\nWP-64370883\r\nWP-93701308\r\nWP-68453939\r\nWP-31691373\r\nWP-34201460\r\nWP-46155175\r\nWP-55441092\r\nWP-51085704\r\n', 'WP-94197586', 'WP-73391125', 'credit', '2022-12-20 10:46:08'),
(625, 3384, 32380, 0.1, 'No', 18, 0, 338.40000000000003, 'PENDING REQUEST- REFUNG CREDITS\r\nWP-87591772\r\nWP-24654113\r\nWP-42383690\r\nWP-62228360\r\nWP-53031875\r\nWP-39170556\r\nWP-73111530\r\nWP-86715770\r\n', 'WP-94197586', 'WP-85476944', 'credit', '2022-12-20 10:47:38'),
(626, 1500, 28996, 0.1, 'No', 18, 0, 150, 'PENDING REQUEST- REFUND CREDITS\r\nWP-45699803\r\nWP-57694663\r\nWP-94278772\r\n\r\n', 'WP-94197586', 'WP-70561606', 'credit', '2022-12-20 10:49:21'),
(627, 1977, 27496, 0.1, 'No', 18, 0, 197.70000000000002, 'PENDING REQUEST-REFUND CREDITS\r\nWP-77791238\r\nWP-37272330\r\nWP-61316276\r\nWP-16902643\r\nWP-98731292\r\nWP-47142597\r\nWP-40158665\r\nWP-51512713\r\n', 'WP-94197586', 'WP-53573947', 'credit', '2022-12-20 10:50:41'),
(628, 1396, 25519, 0.1, 'No', 18, 0, 139.6, 'PENDING REQUEST-REFUND CREDITS\r\nWP-69342580\r\nWP-24567758\r\nWP-73417546\r\n', 'WP-94197586', 'WP-16118552', 'credit', '2022-12-20 10:53:56'),
(629, 2600, 24123, 0.1, 'No', 18, 0, 260, 'PENDING REQUEST- REFUND CREDITS\r\nWP-47312899\r\nWP-18600017\r\nWP-14794295\r\nWP-67627747\r\nWP-59672023\r\nWP-23263274\r\n', 'WP-94197586', 'WP-78954120', 'credit', '2022-12-20 10:55:24'),
(630, 3992, 21523, 0.1, 'No', 18, 0, 399.20000000000005, 'PENDING REQUEST - REFUND CREDITS\r\nWP-72745158\r\nWP-43830828\r\nWP-62261199\r\nWP-87050254\r\nWP-26674839\r\nWP-94672420\r\nWP-42645588\r\nWP-60809345\r\nWP-33049530\r\nWP-24704534\r\nWP-24457418\r\nWP-84822083\r\nWP-41232419\r\n', 'WP-94197586', 'WP-65117802', 'credit', '2022-12-20 10:56:39'),
(631, 1500, 17531, 0.1, 'No', 18, 0, 150, 'PENDING REQUEST-REFUND CREDITS\r\nWP-94161618\r\nWP-29734558\r\nWP-69211169\r\n', 'WP-94197586', 'WP-69149660', 'credit', '2022-12-20 10:58:31'),
(632, 1511, 16031, 0.1, 'No', 18, 0, 151.1, 'PENDING REQUEST-REFUND CREDITS\r\nWP-31804270\r\nWP-73378314\r\nWP-80825994\r\nWP-13867334\r\nWP-55699682\r\nWP-34684254\r\n', 'WP-94197586', 'WP-71524132', 'credit', '2022-12-20 10:59:36'),
(633, 2562, 14520, 0.1, 'No', 18, 0, 256.2, 'PENDING REQUEST- REFUND CREDITS\r\nWP-53188038\r\nWP-78352272\r\nWP-51422929\r\nWP-55140447\r\nWP-34523743\r\nWP-46863945\r\nWP-48039366\r\nWP-81427001\r\nWP-57279516\r\nWP-47509504\r\n', 'WP-94197586', 'WP-19079372', 'credit', '2022-12-20 11:01:05'),
(634, 499, 11958, 0.1, 'No', 18, 0, 49.900000000000006, 'PENDING REQUEST-REFUND CREDITS\r\nWP-70157272\r\n\r\n', 'WP-94197586', 'WP-79182174', 'credit', '2022-12-20 11:03:09'),
(635, 500, 11459, 0.1, 'No', 18, 0, 50, 'PENDING REQUEST-REFUND CREITS\r\nWP-88559793\r\nWP-71566088\r\n', 'WP-94197586', 'WP-66774894', 'credit', '2022-12-20 11:04:09'),
(636, 1300, 10959, 0.1, 'No', 18, 0, 130, 'PENDIG REQUEST-REFUND CREDITS\r\nWP-46255636\r\nWP-49360871\r\nWP-11862176\r\n', 'WP-94197586', 'WP-20091534', 'credit', '2022-12-20 11:05:13'),
(637, 5000, 9659, 0.1, 'No', 18, 0, 500, 'PENDING REQUEST -REFUND CREDITS\r\nWP-52436370\r\nWP-80334820\r\nWP-11833361\r\nWP-32807681\r\nWP-45809694\r\nWP-77608219\r\nWP-60793236\r\nWP-71989633\r\nWP-63159779\r\nWP-20832371\r\nWP-99803297\r\nWP-76613879\r\n', 'WP-94197586', 'WP-98680131', 'credit', '2022-12-20 11:06:23'),
(638, 4658, 4659, 0.1, 'No', 18, 0, 465.8, 'PENDING REQUEST-REFUND CREDITS\r\nWP-15354605\r\nWP-29717079\r\nWP-42826343\r\nWP-66978763\r\nWP-81144354\r\nWP-74065161\r\nWP-37052185\r\nWP-60182044\r\nWP-60201229\r\nWP-26121407\r\n', 'WP-94197586', 'WP-94508852', 'credit', '2022-12-20 11:09:40'),
(639, 112, 9000, 10, 'No', 18, 0, 1120, 'REFUND FOR WP-35448743 ON 20-12-2022\r\n', 'adm01', 'WP-98680131', 'credit', '2022-12-20 10:36:13'),
(640, 55, 7128, 10, 'No', 18, 0, 550, 'REFUND FOR WP-91587248,WP-52546191', 'adm01', 'WP-70561606', 'credit', '2022-12-20 10:49:23'),
(641, 1000, 7183, 10, 'No', 18, 0, 10000, 'DISCARDED AND REFUND FOR WP-84803880,WP-29950614 ON 21-12-2022\r\n\r\n', 'adm01', 'WP-70561606', 'credit', '2022-12-21 07:56:48'),
(642, 500, 10802, 10, 'No', 18, 0, 5000, 'DIDCARDED AND REFUNDED FOR WP-59510298\r\n ON 21-12-2022\r\n ', 'adm01', 'WP-69149660', 'credit', '2022-12-21 07:58:18'),
(643, 500, 10000, 10, 'No', 18, 0, 5000, 'DISCARDED AND REFUNDED FOR WP-61556901 ON 21-12-2022\r\n ', 'adm01', 'WP-66774894', 'credit', '2022-12-21 08:00:07'),
(644, 349, 18901, 10, 'No', 18, 0, 3490, 'DISCARDED AND REFUNDED FOR WP-72976735 ON 21-12-2022\r\n', 'adm01', 'WP-73745417', 'credit', '2022-12-21 08:01:05'),
(645, 506, 3451, 10, 'No', 18, 0, 5060, 'DISCARDED AND REFUNDED FOR WP-56716094 ON 21-12-2022\r\n', 'adm01', 'WP-20091534', 'credit', '2022-12-21 08:01:57'),
(646, 403, 5597, 10, 'No', 18, 0, 4030, 'DISCARDED AND REFUNDED FOR WP-56716094 ON 21-12-2022\r\n', 'adm01', 'WP-79182174', 'credit', '2022-12-21 08:02:41'),
(647, 1621, 7678, 10, 'No', 18, 0, 16210, 'DISCARDED AND REFUNDED FOR WP-50093489\r\nWP-62379223\r\nWP-56035959\r\nON 21-12-2022', 'adm01', 'WP-83883557', 'credit', '2022-12-21 08:03:37'),
(648, 33, 6183, 10, 'No', 18, 0, 330, 'REFUND FOR WP-35911196 ON 22-12-2023', 'adm01', 'WP-70561606', 'credit', '2022-12-22 04:07:43'),
(649, 569, 8500, 10, 'No', 18, 0, 5690, 'REFUND FOR WP-96904076 ON 22-12-2022\r\n', 'adm01', 'WP-83883557', 'credit', '2022-12-22 04:20:23'),
(650, 317, 18900, 10, 'No', 18, 0, 3170, 'REFUND FOR WP-57623235', 'adm01', 'WP-73745417', 'credit', '2022-12-22 04:20:58'),
(651, 500, 3076, 10, 'No', 18, 0, 5000, 'DISCARDED AND REFUNDED FOR WP-13685717 ON 22-12-2022\r\n', 'adm01', 'WP-29313267', 'credit', '2022-12-22 04:22:01'),
(652, 500, 6778, 10, 'No', 18, 0, 5000, 'DISCARDED AND REFUNDED FOR WP-89943289 ON 22-12-2022\r\n', 'adm01', 'WP-99058512', 'credit', '2022-12-22 04:23:06'),
(653, 500, 662, 10, 'No', 18, 0, 5000, 'DISCARDED AND REFUNDED FOR WP-35135044 ON 22-12-2022\r\n', 'adm01', 'WP-71524132', 'credit', '2022-12-22 04:23:50'),
(654, 500, 10000, 10, 'No', 18, 0, 5000, 'DISCARDED AND REFUNDED FOR WP-51477590 ON 22-12-2022\r\n', 'adm01', 'WP-66774894', 'credit', '2022-12-22 04:24:41'),
(655, 500, 2990, 10, 'No', 18, 0, 5000, 'DISCARDED AND REFUNDED FOR WP-93338269 ON 22-12-2022\r\n', 'adm01', 'WP-65117802', 'credit', '2022-12-22 04:25:27'),
(656, 500, 10802, 10, 'No', 18, 0, 5000, 'DISCARDED AND REFUNDED FOR WP-52673891 ON 22-12-2022\r\n', 'adm01', 'WP-69149660', 'credit', '2022-12-22 04:26:18'),
(657, 500, 6216, 10, 'No', 18, 0, 5000, 'DISCARDED AND REFUNDED FOR WP-48139527 ON 22-12-2022\r\n ', 'adm01', 'WP-70561606', 'credit', '2022-12-22 04:26:51'),
(658, 2, 1309, 10, 'No', 18, 0, 20, 'RFUND FOR WP-61601125 ON 23-12-2022\r\n ', 'adm01', 'WP-19079372', 'credit', '2022-12-23 10:07:21'),
(659, 1, 4030, 10, 'No', 18, 0, 10, 'REFUND FOR WP-19087374 ON23-12-2022', 'adm01', 'WP-91161519', 'credit', '2022-12-23 10:07:58'),
(660, 1, 3289, 10, 'No', 18, 0, 10, 'REFUND FOR WP-92329597 on 23-12-2022\r\n', 'adm01', 'WP-65117802', 'credit', '2022-12-23 10:09:09'),
(661, 542, 5224, 10, 'No', 18, 0, 5420, 'REFUND FOR WP-59440337\r\nWP-87665178\r\nWP-62020936\r\nON 23-12-2022', 'adm01', 'WP-70561606', 'credit', '2022-12-23 10:10:17'),
(662, 20000, 0, 10, 'No', 18, 0, 200000, '20K CREDITS ADDED FOR INCOICE S/SL/22-23/252 ON 24-12-2022', 'adm01', 'WP-77880866', 'credit', '2022-12-24 11:59:50'),
(663, 13, 776, 10, 'No', 18, 0, 130, 'REFUND FOR WP-61498176 ON 24-12-2022\r\n', 'adm01', 'WP-53573947', 'credit', '2022-12-24 01:03:16'),
(664, 19, 4766, 10, 'No', 18, 0, 190, 'REFUND FOR WP-19648481 ON 24-12-2022\r\n', 'adm01', 'WP-70561606', 'credit', '2022-12-24 01:04:03'),
(665, 11, 859, 10, 'No', 18, 0, 110, 'REFUND FOR WP-81896974 ON 24-12-2022\r\n', 'adm01', 'WP-71524132', 'credit', '2022-12-24 01:04:58'),
(666, 309, 3189, 10, 'No', 18, 0, 3090, 'REFUND FOR WP-47878183 ON 24-12-2022\r\n ', 'adm01', 'WP-65117802', 'credit', '2022-12-24 01:05:54'),
(667, 500, 4785, 10, 'No', 18, 0, 5000, 'DIACARDED AND REFUND FOR WP-54911934 ON 24-12-2022\r\n ', 'adm01', 'WP-70561606', 'credit', '2022-12-24 01:07:14'),
(668, 500, 1160, 10, 'No', 18, 0, 5000, 'DISCARDED AN DREFUND FOR WP-47172877 ON 24-12-2022\r\n', 'adm01', 'WP-19079372', 'credit', '2022-12-24 01:08:03'),
(669, 3, 1559, 10, 'No', 18, 0, 30, 'REFUND FOR WP-53269272 ON26-12-2022\r\n', 'adm01', 'WP-19079372', 'credit', '2022-12-26 11:26:40'),
(670, 61, 6978, 10, 'No', 18, 0, 610, 'REFUND FOR WP-16936355 ON 26-12-2022\r\n', 'adm01', 'WP-99058512', 'credit', '2022-12-26 11:27:47'),
(671, 30, 3426, 10, 'No', 18, 0, 300, 'REFUND FOR WP-75076279\r\n ON 26-12-2022\r\n', 'adm01', 'WP-29313267', 'credit', '2022-12-26 11:28:34'),
(672, 33, 2010, 10, 'No', 18, 0, 330, 'REFUND FOR WP-56624470\r\n ON 26-12-2022', 'adm01', 'WP-52046036', 'credit', '2022-12-26 11:29:23'),
(673, 35, 4285, 10, 'No', 18, 0, 350, 'REFUND FOR WP-99137842\r\nON 26-12-2022', 'adm01', 'WP-70561606', 'credit', '2022-12-26 11:30:11'),
(674, 355, 4320, 10, 'No', 18, 0, 3550, 'REFUND FOR WP-94107747\r\nON 26-12-2022', 'adm01', 'WP-70561606', 'credit', '2022-12-26 11:30:44'),
(675, 221, 18000, 10, 'No', 18, 0, 2210, 'REFUND FOR WP-61817197\r\nON 26-12-2022', 'adm01', 'WP-77880866', 'credit', '2022-12-26 11:31:10'),
(676, 500, 18221, 10, 'No', 18, 0, 5000, 'DISCARDED AND REFUNDED 500 CREDITS ON 26-12-2022', 'adm01', 'WP-77880866', 'credit', '2022-12-26 11:32:23'),
(677, 200, 588, 10, 'No', 18, 0, 2000, 'REFUNDED FOR WP-24577747\r\n ON 26-12-2022', 'adm01', 'WP-53573947', 'credit', '2022-12-26 11:33:03'),
(678, 150, 2065, 10, 'No', 18, 0, 1500, 'REFUND FOR WP-84599533\r\n ON 26-12-2022', 'adm01', 'WP-78954120', 'credit', '2022-12-26 11:33:38'),
(679, 31, 3306, 10, 'No', 18, 0, 310, 'REFUND FOR WP-28472358\r\nON 26-12-2022', 'adm01', 'WP-29313267', 'credit', '2022-12-26 08:41:45'),
(680, 62, 7039, 10, 'No', 18, 0, 620, 'REFUND FOR WP-28472358\r\nON 26-12-2022', 'adm01', 'WP-99058512', 'credit', '2022-12-26 08:42:44'),
(681, 3, 2480, 10, 'No', 18, 0, 30, 'REFUND FOR WP-19208800\r\nON 26-12-2022', 'adm01', 'WP-85476944', 'credit', '2022-12-26 08:45:33'),
(682, 3, 788, 10, 'No', 18, 0, 30, 'REFUND FOR WP-84910404\r\nON 26-12-2022', 'adm01', 'WP-53573947', 'credit', '2022-12-26 08:46:34'),
(683, 69, 2215, 10, 'No', 18, 0, 690, 'REFUND FOR WP-16680799\r\nON 26-12-2022', 'adm01', 'WP-78954120', 'credit', '2022-12-26 08:47:53'),
(684, 40, 2043, 10, 'No', 18, 0, 400, 'REFUND FOR WP-63458712\r\nON 26-12-2022', 'adm01', 'WP-52046036', 'credit', '2022-12-26 08:49:01'),
(685, 24, 4675, 10, 'No', 18, 0, 240, 'REFUND FOR WP-91744552\r\nON 26-12-2022', 'adm01', 'WP-70561606', 'credit', '2022-12-26 08:50:32'),
(686, 28, 4699, 10, 'No', 18, 0, 280, 'REFUND FOR WP-34862072\r\nON 26-12-2022', 'adm01', 'WP-70561606', 'credit', '2022-12-26 08:51:26'),
(687, 160, 2084, 10, 'No', 18, 0, 1600, 'REFUND FOR WP-58065895\r\nON 27-12-2022', 'adm01', 'WP-78954120', 'credit', '2022-12-27 07:37:47'),
(688, 1, 10300, 10, 'No', 18, 0, 10, 'REFUND FOR WP-17783052\r\nON 27-12-2022', 'adm01', 'WP-66774894', 'credit', '2022-12-27 07:38:14'),
(689, 85, 6951, 10, 'No', 18, 0, 850, 'REFUND FOR WP-95911944\r\nON 27-12-2022', 'adm01', 'WP-99058512', 'credit', '2022-12-27 07:38:52'),
(690, 1, 18567, 10, 'No', 18, 0, 10, 'REFUND FOR WP-12454153\r\nON 27-12-2022', 'adm01', 'WP-73745417', 'credit', '2022-12-27 07:39:30'),
(691, 169, 3137, 10, 'No', 18, 0, 1690, 'REFUND FOR WP-40464077\r\nON 27-12-2022', 'adm01', 'WP-29313267', 'credit', '2022-12-27 07:40:09'),
(692, 87, 1933, 10, 'No', 18, 0, 870, 'REFUND FOR WP-13938553\r\nON 21-12-2022', 'adm01', 'WP-52046036', 'credit', '2022-12-27 07:40:58'),
(693, 296, 8500, 10, 'No', 18, 0, 2960, 'REFUND FOR WP-38521436\r\nON 27-12-2022', 'adm01', 'WP-83883557', 'credit', '2022-12-27 07:41:24'),
(694, 1, 732, 10, 'No', 18, 0, 10, 'REFUND FOR WP-20122024\r\nON 27-12-2022', 'adm01', 'WP-16118552', 'credit', '2022-12-27 07:41:56'),
